UserName,Handle,Timestamp,Text,Comments,Likes,Retweets
BEIBAI,@TwitBeritaBaik,2024-01-15T15:34:17.000Z,Ayo mau kuat-kuatan ama rakyat?,,,
Ichsan,@Ichsaaannnnn,2024-01-15T14:13:28.000Z,"Aturannya, harus secara sporadis dirubah.
Gila sih, terang²an banget sekarang, seolah gak ada marwahnya KPU sm Bawaslu dibuatnya.",,,
Dodi Hermawan,@DodiNavy40,2024-01-16T00:28:55.000Z,Anjing semua asn ini,,,
Jhon,@Jhon92850351,2024-01-15T06:28:59.000Z,Resikonya sangat tingi kalau ada  kecurangan ..bisa terulang Hura Hara nasional,,,
manusiasibuk,@manusiasibuk416,2024-01-15T11:16:50.000Z,pemilu paling aneh.,,,
A. B. Yunus,@4byunus,2024-01-16T04:23:33.000Z,Disandera kasus,,,
Can,@fyi_uie,2024-01-15T16:36:08.000Z,Nangis ajalah liat negeri ini ,,,
bakanosan1,@bakanosan1,2024-01-15T11:01:30.000Z,Belum di dukung pj2 udah lah..,,,
Adi,@adi_adi22260051,2024-01-16T03:04:37.000Z,Kayaknya memang presidennya ini masalahnya,,,
Manusia Sajak,@asepsandro_del,2024-01-15T09:44:54.000Z,Pemilu kali ini kayaknya Negara vs rakyat #AsalBukanPrabowo #AsalBukan02,,,
Ann,@mymeloo_o,2024-01-15T13:16:43.000Z,Real sampah negara,,,
Adin Sukirman1286878899,@Sukiadin884555,2024-01-15T15:35:04.000Z,"Terutama rayuan Dan ancaman  criminal. Boikot. Selain voli... Uang.
Orang tua buta huruf, orang bodoh Dan penakut sasaran Tim sukses capres daerah.
@KPU_ID
 
@DivHumas_Polri
 
@Puspen_TNI",,,
,@susutradaraan,2024-01-15T16:41:23.000Z,Ketar ketir si paling surveyyyy,,,
Thtr,@Thtr34619012,2024-01-15T09:20:42.000Z,sangat,,,
Boneka Chucky,@DidiMeniing,2024-01-15T06:15:10.000Z,Penunjukan PJ kepala daerah olh penguasa kan emg tujuannya mendesain kecurangan dgn TSM,,,
Pemuda setempat,@pmuda_setempat,2024-01-15T15:16:34.000Z,MKMKMK,,,
Andri,@YurisnanAndri7,2024-01-15T16:02:25.000Z,"Tampak mental para pejabat di Pusat dan di Daerah, Mengejar Tahta, Jabatan, Harta. Anak tamat sekolah dasar Saja, Bisa lebih spektakuler membangun Negeri, Jika pembangunan tersebut dari Hasil Berhutang.",,,2
Wahyu Budiono,@bepejeel,2024-01-15T06:57:02.000Z,"Masuk arenanya aja udah curang, gimana pertandingan mau fair play?
Mundur wir, ndasmu gak punya etik!",,,
BukanInfluencer,@bukanbuzzerRp,2024-01-16T03:01:41.000Z,30% proyek dikorupsi siapa yg ngga dukung coba,,,
Hajimul Harun,@HajimulH,2024-01-15T13:21:43.000Z,Prmilu curang menghasilkan pemimpin culas,,,
QOBILTUMAN,@QOBILTUMAN,2024-01-16T01:55:58.000Z,segala upaya utk menjegal dan menggagalkan pak Anies jd presiden sdh nampak sejak lama dan terlihat pak Anies tegar sekokoh karang membuktikan kekuatan nyata bhw blio jls diperhitungkan senyatanya melebihi survey² yg mrk buat atau pesan sendiri bhw kesabaran blio akan petik hasil,,,
Rindu Orang Jujur,@JujurRindu,2024-01-16T01:16:39.000Z,Dia akan tumbamg dan AMIN yg menang,,,
Mohamat Mutajir,@mutajir_mohamat,2024-01-15T23:12:56.000Z,"Jokowi emang harus dilengserkan, untuk mencegah cawe2, penggunaan sumberdaya negara dan pengerahan aparat untuk mendukung paslon, dsb..gak bakalan netral klo jokowi masih presiden..",,1,2
Rindu Orang Jujur,@JujurRindu,2024-01-16T01:14:14.000Z,Katanya survey selalu juara .. ampun deh ... jadi buat apa survey yg lalu no 1,,,
MJ14gf,@EllonMj14,2024-01-16T00:28:32.000Z,Krn jokowi cawe cawe rusak demokrasi indonesia,,,
Panji GEREGETAN,@05Panji,2024-01-15T09:17:06.000Z,"@korantempo
 Klo yg begini termasuk curang nggak ",,,
Pₐ𝚗gₑᵣₐ𝚗 𝘴ₐᗰ𝚋ₑᵣ 𝚝wₑₑ𝚝,@musyaffa2013,2024-01-15T22:52:11.000Z,Lah calon no 2 sudah curang sejak dari lahir!!!!!! kok potensi?,,,
tempo.co,@tempodotco,2024-01-19T02:45:33.000Z,Politikus PDIP Sebut 5 Menteri Dikabarkan Bakal Mundur dari Kabinet Jokowi https://bisnis.tempo.co/read/1823145/politikus-pdip-sebut-5-menteri-dikabarkan-bakal-mundur-dari-kabinet-jokowi?utm_source=Twitter&utm_medium=dlvr.it… #TempoBisnis,302,860,3.6K
King Purwa,@BosPurwa,2024-01-19T06:59:27.000Z,"ikut prihatin,,",129,448,1.7K
Anies Rasyid Baswedan,@aniesbaswedan,2024-01-19T03:58:31.000Z,"Terima kasih kepada seluruh peserta yang sudah hadir di Desak Anies dan bertukar aspirasi dengan kami kemarin! Banyak yang kita bahas secara terbuka terkait isu-isu kesehatan, perempuan, lingkungan hidup dan agraria langsung dengan para pelakunya.

Dua sesi penuh aspirasi dan…",96,1.8K,8.2K
ꦩꦸꦂꦠꦝ,@MurtadhaOne1,2024-01-19T03:59:59.000Z,"Pegiat media sosial ditangkap penyidik Bareskrim karena memposting rekaman komunikasi Jaksa dan Pejabat Forkopinda Batubara yg mengarahkan para Kepala Desa mengkorupsi dana desa 50% untuk kegiatan memenangkan pasangan Prabowo Gibran

MAU JADI APA BANGSA INI?
Kebebasan sipil…",803,3.4K,6.8K
𝑀𝑢ℎ𝑎𝑚𝑎𝑑 𝑄𝑜𝑑𝑟𝑖,@fahmmyqodri,2024-01-13T01:52:24.000Z,"mau lawan juga percuma, kubu sana banyak duitnya. jadi tetap #WakandaForever  :)",,,
faqih usman,@faqihus2022,2024-01-13T01:16:50.000Z,HAAARUS...  Jangan sok sokan kayak kmrn.. tp DATA WAJIB TERKUMPUL DENGAN RIGIT N VALID.,,,
ubinhasnanto,@ubinhasnanto1,2024-01-13T14:41:34.000Z,"AMin harapan indonesia untuk lebih baik punya presiden bergengsi, komunikatif(bicara dua arah baik lokal/international ), sabar, adem yang akan mengayomi semua golongan, cerdas, relegius, bermoral dan bermartabat",,,
Sang Patriot,@SangPatriot08,2024-01-13T00:55:35.000Z,"Berarti kalau tetep kalah, itu karena dicurangi, ngono yo cak?... #Narasi para pecundang",2,1,1
BūĽãñ Pūrbã,@nurhamida2244,2024-01-12T16:24:08.000Z,"Aku cemas loh klu si bapak ini mulai bicara,takut ngomong yg aneh2,sementara pasangannya terlalu lihai berbicara",1,1,1
Lili,@lili4842134,2024-01-12T19:11:36.000Z,"Takut amat ya, percaya dirilah jangan dg cari  sensasi aja",1,1,1
Jumain bakso,@wargaindo2023,2024-01-13T12:11:37.000Z,"Sebenarnya 
@cakimiNOW
 ini siapa? Sampai saat ini masih ngomong ""kalau dicurangi"" kesannya mau ngasih tau pendukungnya bahwa pilpres skrg ini berjalan jujur adil dan normal....jangan jangan cawapres 
@aniesbaswedan
 ini...nganu...nganu...",,,
Ivan,@IPeriansyah,2024-01-13T01:38:18.000Z,"Benarkah???, klo korupsi gimana???",,,
Eko,@Eko68815124,2024-01-13T14:38:10.000Z,Si paling dicurangi,,,
Jack,@nusantara_123,2024-01-13T00:26:26.000Z,Lawan dong kampung pak anis di yaman lagi di bom tuh,,1,1
ًmen,@imenilchen,2024-01-13T07:25:23.000Z,"nah udah ngeluarin statement yang against kejahatan dan pelanggaran aja, gausah bawa-bawa yang di luar itu ya cak. selama masa pilpres ini aja deh. mohon",,,1
leupset,@herdyadrian,2024-01-12T16:55:20.000Z,"@cakimiNOW
 lawan dengan slepet bangun 40 kota setara kajarta ",,,
Jaznir Panai,@BagakPagarah,2024-01-13T07:42:44.000Z,"Kecurangan sdg berlangsung. Fakta ada surat suara di Taiwan udh dicoblos,  ada surat suara tdk ada yg mengawasi seperti di Nias, ada jutaan data pemilih palsu dll, ada capres yg bagi2 uang ke rakyat dibiarkan pengawas pemilu, presiden bagi bagi bansos untuk mendukung capres no. 2",1,,7
Faral,@FSutalaksana,2024-01-13T09:48:39.000Z,slepet cak!,,,
SEMOGA ALLAH BERIKAN 01 KEMENANGAN. AMIN,@ANNasakom,2024-01-13T13:37:14.000Z,"Bkn dilawan....
Tp...
Perangi...",,,
Back To December,@68Afz,2024-01-13T10:42:06.000Z,Mantap Gus Imin... Salut...,,,
AF AIS,@AFAIS19,2024-01-13T01:02:23.000Z,Slepet cakk,,,
Thtr,@Thtr34619012,2024-01-13T05:46:50.000Z,potensi,,,2
Sunan,@hendrsunndr,2024-01-13T04:12:16.000Z,"Demi keadilan rakyat & kelangsungan demokrasi pemilu harus adil dan jujur...
Terimakasih cak Imin
Mantap...",,,1
Agung,@gusti_supartha,2024-01-13T02:00:22.000Z,Itu pasti! Tapi kalau yg curang kelompok lu Imien? Kan kader lu ada di pemerintahan?,1,,
K_Cunk,@K_Cunk69,2024-01-15T01:28:02.000Z,"Ingat NU jangan libatkan dengan partai, hak pilih bebas",,,
Irwan,@Iwan_sebastian1,2024-01-13T15:38:54.000Z,Itu wajib,,,
Mirz,@bagindamaulanaa,2024-01-13T04:45:05.000Z,We are behind you El Slepet,,,
Palestine Is Power,@moshpito,2024-01-13T05:27:29.000Z,Caranya?,,,
anaksalatiga,@sepbol_Salatiga,2024-01-12T18:19:15.000Z,Kalo bisa pake VAR cak,,,
Math Thorq,@MathThorq,2024-01-13T10:25:50.000Z,Klo ngelawan cak imin bantuin gak? Nanti kayak yg ono dah dibelain ada yg mati pulak eh malah ngelamar kerja di tempat lawan. Awokwkwk,,,
acbk,@achmadb63005407,2024-01-13T01:07:22.000Z,Lawannya 9 naga pak...susah...juga situs kpu denger denger gampang di jebol,1,,
suryasena,@suryasena53,2024-01-12T21:59:00.000Z,"Gituh cak????
Ati² jangan² nanti dari pihak sendiri juga melakukan?",,,
Raharjo,@raharjo1987,2024-01-13T11:12:49.000Z,"Jadi menteri aja ga kepikiran apalagi jadi wapres...
Lucu lucian aja loe min..",,,
Tarjo',@raden_gendowor,2024-01-14T02:29:56.000Z,"Min min, sejak gabung Anies dadi Kadrun pisan, belum mulai wes teriak curang curang, zaman koyo ngene curang e pie...",,,
Tuan Krab,@rajadau88023942,2024-01-13T04:02:00.000Z,Lawan! Cuma kecurangan yg bisa bikin ca imin jd cawapres.,,,
roni cau,@cau_roni53017,2024-01-13T03:53:37.000Z,dalam pertandingan klo wasitnya berat sebelah  ya mau bagaimana lg.. memang bisa,,,
Jerry Pane,@jerrypane728,2024-01-13T21:56:53.000Z,"Gak salah tu, sedangkan pak gusdur aja anda curangi apalagi rakyat.",,,
Agussubarkah,@Agussubarkah23,2024-01-13T06:28:24.000Z,Lawan pakek apa??,,,2
Toranku Art,@Torankuart,2024-01-13T17:59:56.000Z,Bgmn klu anda yg curang,,,
Ari Parapat,@ParapatAri76905,2024-01-13T00:11:59.000Z,"Kulon kulon,..",,,
Warnilis Ssn,@Warnilisssn,2024-01-12T18:07:38.000Z,nggk tipemu melawan ntar setelah kalah anda duluan gabung yg menang,,,
Jeny,@ZEN70643656,2024-01-12T17:54:57.000Z,PKB tpi bnyak yg pilih prabowo,,,
teroris yaman,@gentayangan79,2024-01-13T00:54:12.000Z,Siapa yg mencurangi loh aja sensitif udah merasa kalah karena udah rugi bandar ngutang sana sini buat kampanye,,1,
STILL LIFE,@virgotiaaa,2024-01-13T13:02:19.000Z,Ah bisa aj yg pgn kekuasaan..biasa aj dong,,,
We need food,@khumizh,2024-01-12T16:27:23.000Z,Adu argumen lah! Ngapain begitu,,,
KOMPAS TV,@KompasTV,2024-01-17T11:01:37.000Z,TPN Ganjar-Mahfud: Ada Konspirasi untuk Memenangkan Prabowo-Gibran di Pilpres 2024,81,174,648
shahryl,@syahryl,2024-01-17T23:18:33.000Z,itu benner mangkanya di survei-survei itu di gelembungkan elektabilitas supaya ada alasan legitimasi setelah pilpres sama seperti yg dulu-dulu itulah konspirasinya dari awal semua sdh di setting genk's,,,
b3'doel,@B3doel___,2024-01-18T05:18:20.000Z,"bau hasil survei bayaran juga menyengat, selalu mengkondisikan sesuatu yg tidak nyata...",,1,2
Koiinthedark,@ChallsOfrivia,2024-01-17T11:39:31.000Z,"TPN kok isinya orang2 b0s0k??
Nuduh ini itu, Menghasut sana sini, bikin narasi sesat, menjelek2an paslon lain..
Kampanye kubu Ganjar ini pokoknya HARUS NUDUH2 MEMBABI BUTA..
Makin gak simpati sama sekali...",2,,16
𝐼𝒶𝓂𝑀𝑒,@ChikoLoli,2024-01-17T21:21:02.000Z,"Sampai ini terjadi bisa kejadian reformasi 2.0

Kami MUAK!!!",,,
Rah_kmadi™,@Rah_kmadi,2024-01-17T22:02:19.000Z,"Makanya sudah layak dimakzulkan pak lurah,agar pemilu bisa adil",,,
Harry Prasetyo,@pr4s3ty0harry,2024-01-18T02:16:50.000Z,"Mau curang disiapkan dulu perangkat perangkatnya, media medianya, hasil survey nya. semoga Allah menjungkalkan pihak yang curang, dan kemenangan menjadi milik rakyat Indonesia, lanjut memproses pelaku kecurangan",,,
Lukman Sadega,@LukmanSadega16,2024-01-17T11:18:05.000Z,Kemiskinan dipelihara negara agar yg miskin dan lemah mudah dibodohi oleh penguasa,1,1,5
tempo.co,@tempodotco,2024-01-19T08:35:56.000Z,"Sri Mulyani dikabarkan hendak mundur dari kabinet Jokowi.

Perbedaan pendapat dengan Menteri Pertahanan Prabowo Subianto jadi salah satu pemicunya??

#TempoThread #SriMulyani #KementerianKeuangan",74,626,2.4K
CELOTEH RECEH,@M45Broo,2024-01-19T01:01:07.000Z,Monggo silahkan dijawab... ,4.4K,945,3.8K
KOMPAS TV,@KompasTV,2024-01-18T23:23:33.000Z,Anies Pilih JIS buat Kampanye Terakhir: Kapasitas Besar dan Simbol Keringat Anak Bangsa,240,1.4K,8.1K
CNN Indonesia,@CNNIndonesia,2024-01-19T09:35:59.000Z,Survei Bloomberg ke 17 Ekonom: Anies Unggul dari Prabowo dan Ganjar,57,668,2.5K
Koran Tempo,@korantempo,2024-01-15T02:59:37.000Z,"Potensi kecurangan dalam Pemilu 2024 meningkat. Banyak kepala daerah yang bergabung dengan tim sukses pasangan calon presiden.

#KoranTempo",122,989,1.7K
Casper_butterfly14,@FarisKaisan,2024-01-15T11:53:00.000Z,"@pikaso_me
 screenshot this!",1,,
Pikaso,@pikaso_me,2024-01-15T11:55:37.000Z,"Enjoy your screenshot and...

Get 10 stickers for $1: https://stickermule.com/pikaso",,,1
Afifah Afra,@afifahafra79,2024-01-16T01:54:59.000Z,Pas dilantik disumpah di bawah kitab suci padahal.,,,1
Anak Bangsa,@AliKadir777999,2024-01-15T03:37:51.000Z,"Kepala daerah kalau mau jadi tim sukses mundur aja dari kepala daerah supaya orang gak menuduh fasilitas negara di gunakan untuk kepentingan partai dan pasangan calon ...jgn bermuka dua, jabatan mau jadi tim sukses mau itu nmanya gak buka kesatria....",3,2,14
Mulyadi,@Mulyadi34969220,2024-01-15T03:34:02.000Z,Menang dg kecurangan = kehancuran suatu bgsa KKN akan mrajalela dianggap hal biasa keadilan anya fatamorgana,,2,27
TIM PERCEPATAN GEOPARK & BIOSPHER di PULAU SUMBAWA,@SangiangBimaPS,2024-01-16T01:21:53.000Z,"@aniesbaswedan
 @suryapaloh51
@cakimiNOW
 @Metro_TV
Fokus Rekapitulasi suara.

- Saksi TPS hrs pulang bawa C1 hologram dari TPS. 
- Juga saksi PPS Desa/Kelurahan,
- Saksi tkt PPK Kecamatan,
- Saksi tingkat KPUD Kab/Kota.
 Saksi jgn pulang jika blm dpt C1 Hologram/Hsl Rekap Asli",,,
apa_tar,@de2n_ramdhan,2024-01-15T10:43:53.000Z,"Wah. Wah. Wah.

Kampanye apa ini.? Segala macam dilakukan oleh @bobbynasution_ dgn mengumpulkan kepsek SD & SLTP Negeri di Medan ya..

Ini gak asal bicara loh..
Ada Nardi pasaribu Kepsek SD Negri SD Negri 064023 ada Yg SD Negri Johor yg berjenggot pjg namanya Naldi.?

Viralkan..!",,1,2
gun,@GunBaskoro,2024-01-15T17:03:33.000Z,Ya negeri ini makin hancur.. Tinggal menunggu bala dari sang Pencipta Alam.. Siap2 lah Indonesia... Menunggu petaka..,1,,
Aang Kurniawan,@AangKur54074556,2024-01-15T23:07:57.000Z,"Potensi 
Terbukti ",,,1
Putra Samudra,@Imamsan98674902,2024-01-16T02:30:22.000Z,"Selama ada jokowi menjabat potensi kecurangan sdh pasti banyak
Belum di mulai saja sdh marak",,,
Jango,@Jango25541138,2024-01-15T17:35:52.000Z,"Dari dulu golput, cuma pemilu ini hati tergerak milih Anies Baswedan ",,,
Eenk,@esti_joko,2024-01-15T17:58:46.000Z,Poinnya di Bawaslu tp dengan banyaknya pelanggaran yg terstruktur dan sistematis lebih gila lagi sekarang berani terang terangan melanggar aturan Bawaslu tutup mata seolah olah lembaga tersebut ga kuasa utk melakukan tindakan,1,1,5
Eko,@Eko68815124,2024-01-15T09:35:54.000Z,Yup di Jateng buanyak banget tim sukses 03,,,
Abaluh,@BYTriantono,2024-01-15T05:34:52.000Z,Udahlah ga usah ada pemilu klo bgini,,3,5
Andy Garcia,@AndyGar95650906,2024-01-15T04:51:33.000Z,"Kecurangan dan uang sebanyak apapun alam semesta tidak berpihak pada kalian.
Salam...",,3,1
z,@Sumpeno60879101,2024-01-16T02:27:03.000Z,Pemilu terburuk,,,
JustMerakyatbiasa,@MeRakyatbiasa24,2024-01-15T04:30:26.000Z,Contoh paling nyata  gub Jawa timur,,,
nasy,@nasy1176063,2024-01-15T19:22:17.000Z,Benar,,,3
leonardo hertanto,@leohertanto,2024-01-15T18:13:25.000Z,biar kena makan sumpah yg mereka sumpah pas pelantikan,,,
Kaji Taufan,@kajitaufan,2024-01-16T00:24:28.000Z,Makin yakin utk tidak memilih 02,,,
FarenNFT,@faren717728,2024-01-16T00:42:51.000Z,Knpa pd ga netral ya ada apa,,,
Dasep Data,@Dasep_8898,2024-01-15T16:59:42.000Z,"Lantik aja langsung.
Ngapain ada pemilu kalau pada melanggar tapi gak ada sanksi.",,,
ag ya,@ag_ya_ya,2024-01-15T13:48:43.000Z,Wkt 2019 gimana ya? ,,,
Sendi setiawan,@Boni1553574,2024-01-16T02:52:34.000Z,"Pada bersumpah di atas Alquran tapi,pada ingkar janji astagfirullah.",,,
Purwanto,@Purwanto1111262,2024-01-15T12:13:46.000Z,Kepala daerah ini cerminannya rezim dholim  yg sekarang berkuasa untuk itu makzulkan,,,
Dampit Kabul,@DampitKabul,2024-01-15T14:24:35.000Z,"Bukan potensi lagi, tp sudah terjadi secara massif dan terstruktur",,,1
Ang Chun,@ang_chun,2024-01-15T13:59:05.000Z,"100% akan ada kecurangan, kecurangan itu akan dilakukan penguasa yang dukung 02.",,1,2
#Freedom,@cumaJamal,2024-01-16T00:31:06.000Z,"harusnya ada badan independen yg mangawasi & mengaudit logistik / gudang yg ada di instansi2 pemerintah...dng menggunakan kantor2/instansi pemerintah sbg gudang2 logistik, sangat2 tidak profesional, potensi kecurangan sangat2 mungkin terjadi..",,,1
LajuSore,@ABaz_KAra,2024-01-15T18:07:08.000Z,"Banyak ASN yang juga disuruh nyoblos caleg tertentu dengan ancaman dimutasi dijakarta lagi kementrian yang selogannya iklas beramal 
@BocorAlusPol",,,
Cotton Candy,@LilSweet_Dy,2024-01-16T01:43:15.000Z,"Hemmm
Jadi pengen ganti rakyat aja
Jujurly, gue kasian sama siapapun yg jadi Presidennya atau pun Pak Presiden saat ini.
Ya gimana nggak kasian, rakyatnya aja... Ah udahlah. Susah diajak maju",,,
OmWox,@WowokOhm,2024-01-16T02:12:31.000Z,Awasi aja di semua TPS jgn main framing mulu ..,,,
Alfa,@Alfa_Bimas,2024-01-15T23:31:46.000Z,Hancur diacak2 sm penikmat reformasi,,,
I-smile,@bm_ismail,2024-01-16T00:29:46.000Z,"Stop kecurangan! 
Pejabat publik jadi timses semestinya harus mundur!",,,
Ali farihi,@alifarihin69,2024-01-16T00:08:01.000Z,Kemungkinan pemilu 2024 Rakyat vs Pemerintah,,,
Orang Pinggiran,@kanjengGondoku1,2024-01-15T09:29:35.000Z,kepala daerah kan berasal dari partai politik ya jadinya nggak bisa nahan nafsu utk bertarung pllitik,,,
Jakatim,@Jakatim123,2024-01-16T01:32:41.000Z,"Sudah ...
Potensi meningkat",,,
Ray Tanjunģ,@rayxtreem,2024-01-15T14:54:20.000Z,Cerminan ketakutan...malu curang tak dipedulikan akibat paksaan nafsu menang karena jika kalah penjara mengancam.,,,
Abdul Wahab Al-Bilal,@AbdulWahabAlBi2,2024-01-15T15:56:16.000Z,"Waspada... Kita sedang berada di era kekuasaan, bukan kepemimpinan seorang presiden... 

2024",,,
Budi wijayanto,@Budibooth,2024-01-16T11:54:15.000Z,Apakah pemakzulan bisa diimplementasikan?,,,
Aditya Joe Nugraha,@diditcuul,2024-01-15T23:52:47.000Z,"Tanda2 berakhirnya era demokrasi menuju era demokrazy  dimana Ketidak benaran di pertontonkan dan di dukung undang2,, terima kasih pak jokowi  sehat selalu ,,",,,1
fawzia,@fawzia_be,2024-01-15T16:19:56.000Z,Turunkan Jokowiiiiiiii,,,
Slamet rahardjo,@Slamethardjo19,2024-01-16T05:29:53.000Z,Udahlah bertaruh nyawa sekalian kalo liat kecurangan di TPS gelud sekalian,,,
Leonard F. Galistan,@LeonardFaried,2024-01-15T14:03:15.000Z,Lawan segala bentuk kecurangan². Laporkan.,,,1
ariv,@arivrahman79,2024-01-16T00:14:06.000Z,Jaman ini memang parah,,,
AMIN ajah,@kanksetya,2024-01-16T08:21:19.000Z,Sebutkan paslon nomor berapa yg berpotensi banyak melakukan kecurangan biar abstrak danta jelas.  Biar rakyat tidak ikut milih yg didukung kepala daerah dan atau tni polri,,,
Muza,@muza16335,2024-01-15T23:36:30.000Z,Pertanyaan saya apa hukuman untuk team paslon yg melakukan kecurangan??,,,
nicole,@nicolesyahp,2024-01-15T10:55:29.000Z,"Cawe Cawe Presiden tanpa etika…….!!!!!
Berbuat sesukanya, tida satupun ada yang berani ambi tindakan…..!!!!!",,,1
MuhammadSuryaHusada,@husada_muhammad,2024-01-15T16:06:10.000Z,TENGGELAMKAN...,,,
Rindu Orang Jujur,@JujurRindu,2024-01-16T01:15:25.000Z,Apa gunanya survey selalu juara 1 ????,,,
아지스28,@BoysAlaziz28,2024-01-15T10:32:31.000Z,"Ini yg gw khawatirin, & sialnya warga menganggap ini lumrah. Anjrrrr !!",,,
Fanny Kurniawan,@Fannykur29,2024-01-15T07:54:03.000Z,Akibat cawe-cawe,,,
Rakyat Jelata,@RakyatJ03058307,2024-01-15T05:07:38.000Z,"ASN harus netral... tapi kepalanya boleh berpihak. Dan ga harus cuti...

Sehat?",,,
BEIBAI,@TwitBeritaBaik,2024-01-15T15:34:17.000Z,Ayo mau kuat-kuatan ama rakyat?,,,
Ichsan,@Ichsaaannnnn,2024-01-15T14:13:28.000Z,"Aturannya, harus secara sporadis dirubah.
Gila sih, terang²an banget sekarang, seolah gak ada marwahnya KPU sm Bawaslu dibuatnya.",,,
Dodi Hermawan,@DodiNavy40,2024-01-16T00:28:55.000Z,Anjing semua asn ini,,,
Jhon,@Jhon92850351,2024-01-15T06:28:59.000Z,Resikonya sangat tingi kalau ada  kecurangan ..bisa terulang Hura Hara nasional,,,
manusiasibuk,@manusiasibuk416,2024-01-15T11:16:50.000Z,pemilu paling aneh.,,,
A. B. Yunus,@4byunus,2024-01-16T04:23:33.000Z,Disandera kasus,,,
Can,@fyi_uie,2024-01-15T16:36:08.000Z,Nangis ajalah liat negeri ini ,,,
bakanosan1,@bakanosan1,2024-01-15T11:01:30.000Z,Belum di dukung pj2 udah lah..,,,
Adi,@adi_adi22260051,2024-01-16T03:04:37.000Z,Kayaknya memang presidennya ini masalahnya,,,
Manusia Sajak,@asepsandro_del,2024-01-15T09:44:54.000Z,Pemilu kali ini kayaknya Negara vs rakyat #AsalBukanPrabowo #AsalBukan02,,,
Ann,@mymeloo_o,2024-01-15T13:16:43.000Z,Real sampah negara,,,
Adin Sukirman1286878899,@Sukiadin884555,2024-01-15T15:35:04.000Z,"Terutama rayuan Dan ancaman  criminal. Boikot. Selain voli... Uang.
Orang tua buta huruf, orang bodoh Dan penakut sasaran Tim sukses capres daerah.
@KPU_ID
 
@DivHumas_Polri
 
@Puspen_TNI",,,
,@susutradaraan,2024-01-15T16:41:23.000Z,Ketar ketir si paling surveyyyy,,,
Thtr,@Thtr34619012,2024-01-15T09:20:42.000Z,sangat,,,
Boneka Chucky,@DidiMeniing,2024-01-15T06:15:10.000Z,Penunjukan PJ kepala daerah olh penguasa kan emg tujuannya mendesain kecurangan dgn TSM,,,
Pemuda setempat,@pmuda_setempat,2024-01-15T15:16:34.000Z,MKMKMK,,,
Andri,@YurisnanAndri7,2024-01-15T16:02:25.000Z,"Tampak mental para pejabat di Pusat dan di Daerah, Mengejar Tahta, Jabatan, Harta. Anak tamat sekolah dasar Saja, Bisa lebih spektakuler membangun Negeri, Jika pembangunan tersebut dari Hasil Berhutang.",,,2
Wahyu Budiono,@bepejeel,2024-01-15T06:57:02.000Z,"Masuk arenanya aja udah curang, gimana pertandingan mau fair play?
Mundur wir, ndasmu gak punya etik!",,,
BukanInfluencer,@bukanbuzzerRp,2024-01-16T03:01:41.000Z,30% proyek dikorupsi siapa yg ngga dukung coba,,,
Hajimul Harun,@HajimulH,2024-01-15T13:21:43.000Z,Prmilu curang menghasilkan pemimpin culas,,,
QOBILTUMAN,@QOBILTUMAN,2024-01-16T01:55:58.000Z,segala upaya utk menjegal dan menggagalkan pak Anies jd presiden sdh nampak sejak lama dan terlihat pak Anies tegar sekokoh karang membuktikan kekuatan nyata bhw blio jls diperhitungkan senyatanya melebihi survey² yg mrk buat atau pesan sendiri bhw kesabaran blio akan petik hasil,,,
Rindu Orang Jujur,@JujurRindu,2024-01-16T01:16:39.000Z,Dia akan tumbamg dan AMIN yg menang,,,
Mohamat Mutajir,@mutajir_mohamat,2024-01-15T23:12:56.000Z,"Jokowi emang harus dilengserkan, untuk mencegah cawe2, penggunaan sumberdaya negara dan pengerahan aparat untuk mendukung paslon, dsb..gak bakalan netral klo jokowi masih presiden..",,1,2
Rindu Orang Jujur,@JujurRindu,2024-01-16T01:14:14.000Z,Katanya survey selalu juara .. ampun deh ... jadi buat apa survey yg lalu no 1,,,
MJ14gf,@EllonMj14,2024-01-16T00:28:32.000Z,Krn jokowi cawe cawe rusak demokrasi indonesia,,,
Panji GEREGETAN,@05Panji,2024-01-15T09:17:06.000Z,"@korantempo
 Klo yg begini termasuk curang nggak ",,,
Pₐ𝚗gₑᵣₐ𝚗 𝘴ₐᗰ𝚋ₑᵣ 𝚝wₑₑ𝚝,@musyaffa2013,2024-01-15T22:52:11.000Z,Lah calon no 2 sudah curang sejak dari lahir!!!!!! kok potensi?,,,
tempo.co,@tempodotco,2024-01-19T02:45:33.000Z,Politikus PDIP Sebut 5 Menteri Dikabarkan Bakal Mundur dari Kabinet Jokowi https://bisnis.tempo.co/read/1823145/politikus-pdip-sebut-5-menteri-dikabarkan-bakal-mundur-dari-kabinet-jokowi?utm_source=Twitter&utm_medium=dlvr.it… #TempoBisnis,302,860,3.6K
King Purwa,@BosPurwa,2024-01-19T06:59:27.000Z,"ikut prihatin,,",129,448,1.7K
Anies Rasyid Baswedan,@aniesbaswedan,2024-01-19T03:58:31.000Z,"Terima kasih kepada seluruh peserta yang sudah hadir di Desak Anies dan bertukar aspirasi dengan kami kemarin! Banyak yang kita bahas secara terbuka terkait isu-isu kesehatan, perempuan, lingkungan hidup dan agraria langsung dengan para pelakunya.

Dua sesi penuh aspirasi dan…",96,1.8K,8.2K
ꦩꦸꦂꦠꦝ,@MurtadhaOne1,2024-01-19T03:59:59.000Z,"Pegiat media sosial ditangkap penyidik Bareskrim karena memposting rekaman komunikasi Jaksa dan Pejabat Forkopinda Batubara yg mengarahkan para Kepala Desa mengkorupsi dana desa 50% untuk kegiatan memenangkan pasangan Prabowo Gibran

MAU JADI APA BANGSA INI?
Kebebasan sipil…",803,3.4K,6.8K
𝑀𝑢ℎ𝑎𝑚𝑎𝑑 𝑄𝑜𝑑𝑟𝑖,@fahmmyqodri,2024-01-13T01:52:24.000Z,"mau lawan juga percuma, kubu sana banyak duitnya. jadi tetap #WakandaForever  :)",,,
faqih usman,@faqihus2022,2024-01-13T01:16:50.000Z,HAAARUS...  Jangan sok sokan kayak kmrn.. tp DATA WAJIB TERKUMPUL DENGAN RIGIT N VALID.,,,
ubinhasnanto,@ubinhasnanto1,2024-01-13T14:41:34.000Z,"AMin harapan indonesia untuk lebih baik punya presiden bergengsi, komunikatif(bicara dua arah baik lokal/international ), sabar, adem yang akan mengayomi semua golongan, cerdas, relegius, bermoral dan bermartabat",,,
Sang Patriot,@SangPatriot08,2024-01-13T00:55:35.000Z,"Berarti kalau tetep kalah, itu karena dicurangi, ngono yo cak?... #Narasi para pecundang",2,1,1
BūĽãñ Pūrbã,@nurhamida2244,2024-01-12T16:24:08.000Z,"Aku cemas loh klu si bapak ini mulai bicara,takut ngomong yg aneh2,sementara pasangannya terlalu lihai berbicara",1,1,1
Lili,@lili4842134,2024-01-12T19:11:36.000Z,"Takut amat ya, percaya dirilah jangan dg cari  sensasi aja",1,1,1
Jumain bakso,@wargaindo2023,2024-01-13T12:11:37.000Z,"Sebenarnya 
@cakimiNOW
 ini siapa? Sampai saat ini masih ngomong ""kalau dicurangi"" kesannya mau ngasih tau pendukungnya bahwa pilpres skrg ini berjalan jujur adil dan normal....jangan jangan cawapres 
@aniesbaswedan
 ini...nganu...nganu...",,,
Ivan,@IPeriansyah,2024-01-13T01:38:18.000Z,"Benarkah???, klo korupsi gimana???",,,
Eko,@Eko68815124,2024-01-13T14:38:10.000Z,Si paling dicurangi,,,
Jack,@nusantara_123,2024-01-13T00:26:26.000Z,Lawan dong kampung pak anis di yaman lagi di bom tuh,,1,1
ًmen,@imenilchen,2024-01-13T07:25:23.000Z,"nah udah ngeluarin statement yang against kejahatan dan pelanggaran aja, gausah bawa-bawa yang di luar itu ya cak. selama masa pilpres ini aja deh. mohon",,,1
leupset,@herdyadrian,2024-01-12T16:55:20.000Z,"@cakimiNOW
 lawan dengan slepet bangun 40 kota setara kajarta ",,,
