UserName,Handle,Timestamp,Text,Comments,Likes,Retweets
Charyl chappuis,@DadanSudjana3,2024-01-21T07:48:11.000Z,Ah.. pak Anies cuma bisa ngomong doang. Sy mau bukti! Makanya tgl 14 Febuari nanti saya Coblos 01 karena mau lihat beliau membuktikan kata katanya ,,,
Achmad Ichzan Zadly,@aizura2019,2024-01-21T08:07:27.000Z,Kok sepi banget yah keliatannya hahaha,,,
Suluh'98,@AH_SiregarXIX,2024-01-21T08:31:05.000Z,"Sumbar-Riau itu AMIN 
@andre_rosiade
. Habih pitih waang tak urang awak pilih Prabowo-Gibran. Lagian 
@gibran_tweet
 ngajak milih mas 
@ganjarpranowo
 kok. Ini videonya.",,1.0,3.0
Abdullah Yanto,@abdullah_yanto,2024-01-21T07:29:39.000Z,"Sumatera dulu Prabowo , karena Prabowo vs Jokowi.
Sekarang Prabowo = Jokowi !

Ngapain pilih Prabowo ???",,,5.0
Habil,@Wan_2045,2024-01-21T08:24:04.000Z,"Pasti gak perna baca buku ya? Elit pendukung Prabowo sebagian besar modalnya berani aja. Yg hebat 
@budimandjatmiko
 dan 
@Yusrilihza_Mhd
 aja, sisanya modal berani doang ",,,
Daeng Baji',@Andi00583950,2024-01-21T09:01:57.000Z,Mmmmmm.... Halu stadium aqut.,,,
anitaria,@anitaria1370021,2024-01-21T09:59:10.000Z,pak prabowo itu pendukungnya beuh banyak sekalii ya ternyata,,,
Larasati,@Larasatiaayes,2024-01-21T09:31:33.000Z,"Nggak bisa dipungkiri, Ganjar Pranowo paham bahwa internet itu bukan sekadar lahan hiburan, tapi juga pintu ilmu yang besar.",,,
Jasminetea,@jasminetea73_,2024-01-21T10:32:21.000Z,Yuu bisa pak Ganjar Mahfud menang agar rakyat merasakan kemudahan dalam apapun,,,
Lala Nrl,@nrllala4,2024-01-21T10:29:58.000Z,Masyarakat membutuhkan akses informasi teknologi yang mudah dengan internet yah pak Ganjar,,,
Rahamaniaazr,@rahamaniaazr,2024-01-21T10:31:49.000Z,Bener bener sat set deh pak Ganjar Pranowo ini cocok untuk jadi presiden RI,,,
Rendy Ariansyah,@RendyArn,2024-01-21T10:18:36.000Z,Pak Ganjar pemikiran nya jauh kedepan dan paham penting nya Internet,,,
natashly,@natashly8,2024-01-21T10:30:31.000Z,Bener yah pak Ganjar program nya itu kekinian dan mengedepankan kepentingan dan kebutuhan rakyatnya,,,
Fandi Saputra,@FandiSapt,2024-01-21T10:19:24.000Z,Sekarang internet sangat dibutuhkan untuk pendidikan dan pekerja an bisa akses informasi dengan cepat bener kata pak Ganjar,,,
nopale-,@nfxpall,2024-01-21T10:03:54.000Z,"Terima kasih, Pak Ganjar, karena mendukung perkembangan industri kreatif.",,,
Fajrianoor,@preofil,2024-01-21T10:01:20.000Z,"Selamat, Pak Ganjar, karena keberhasilan Anda menciptakan lapangan kerja baru.",,,
Monika,@Monikanicee,2024-01-21T09:35:33.000Z,Poin Pak Ganjar Pranowo tentang internet lebih dari makan gratis menunjukkan dia fokus pada pendidikan dan kesejahteraan masyarakat.,,,
Jagoa,@kandangjagoo,2024-01-21T09:32:05.000Z,"Bagus deh Pak  Ganjar Pranowo ngebangun awareness tentang pentingnya internet, terutama untuk pendidikan dan informasi.",,,
dessyy,@desturoy,2024-01-21T10:02:12.000Z,"Pak Ganjar, kebijakan pendidikan Anda membuka pintu peluang bagi banyak orang.",,,
Nivaindah,@nivaindah0,2024-01-21T09:30:51.000Z,"Suka banget sama respons Ganjar Pranowo, membuktikan dia peduli sama kemajuan teknologi dan edukasi melalui internet.",,,
barudin,@barudin76,2024-01-21T09:31:11.000Z,Pak Ganjar Pranowo ngasih perhatian ke pentingan internet menunjukkan visi pemimpin yang memahami perkembangan zaman.,,,
Darman Suhendi,@Dsuhendii,2024-01-21T10:16:46.000Z,Internet dibutuhkan untuk mendapatkan informasi yang cepat penting juga untuk pendidikan,,,
Grice Deana,@deana_gric54723,2024-01-21T10:32:54.000Z,Makin yakin pak Ganjar pemimpin yang cocok untuk negeri ini,,,
Abdullah,@Abdullah1134280,2024-01-21T09:32:41.000Z,"Dukung banget sikap Pak Ganjar yang ngasih nilai tinggi ke internet, membuktikan dia punya wawasan yang luas.",,,
zkry,@claowns,2024-01-21T10:03:23.000Z,"Selamat, Pak Ganjar, karena kepedulian Anda terhadap kesejahteraan buruh.",,,
cahaya,@caxhaya,2024-01-21T10:02:43.000Z,"Terimakasih, Pak Ganjar, karena menjadi pelopor perubahan positif di Indonesia.",,,
Nadya Anisa,@NadyaAn44,2024-01-21T10:14:40.000Z,Sekarang semua nya sudah digitalisasi untuk informasi dan pendidikan juga perlu,,,
Anwar Ramdani,@AnwarRamd,2024-01-21T10:14:02.000Z,Setuju juga kata pak Ganjar memang sekarang bukan hanya hiburan tapi juga untuk pendidikan,,,
apis,@tunjhuk,2024-01-21T10:01:39.000Z,"Sukses terus, Pak Ganjar, sebagai pionir kemajuan teknologi di Indonesia.",,,
Reyz_Fanss,@ReyzzFanss_,2024-01-21T10:00:23.000Z,Pak Ganjar sangat peduli akan pendidikan dan informasi dijaman sekarang ini. Gaspoll pak,,,
pea,@feools,2024-01-21T10:01:54.000Z,"Terima kasih, Pak Ganjar, karena perhatian Anda terhadap kemajuan desa-desa.",,,
Rahmasyf,@rahmaasyf,2024-01-21T10:31:20.000Z,Seneng banget deh pak Ganjar ini sangat mengerti akan kemajuan teknologi,,,
radit dit dit,@dipanggiladitt,2024-01-21T10:03:38.000Z,"Sukses terus, Pak Ganjar, sebagai pembela lingkungan yang gigih.",,,
Rian Fareza,@rianfarez,2024-01-21T10:12:47.000Z,Bener banget pak Ganjar internet dibutuhkan  juga untuk mendapatkan informasi,,,
Dewi Annisa,@DewiAnss,2024-01-21T10:16:07.000Z,Semua lebih mudah dan cepat kalau ada internet setuju dengan pak Ganjar,,,
Riyan Revano,@RiyanRevano,2024-01-21T10:15:20.000Z,Pak Ganjar terbaik program nya yakin bisa membawa perubahan,,,
VerooXinn,@VerooXinn,2024-01-21T09:58:54.000Z,Pak Ganjar peduli akan kemajuan teknologi dan kesejahteraan rakyat,,,
#PTNolPersen,@ptnolpersen,2024-01-21T07:58:38.000Z,Counter attack kurang signifikan. Kasih upper cut dong..,,,
Worcester Rickard,@WorcesterR10237,2024-01-21T10:33:56.000Z,Pak Ganjar yang terbaik daripada yang lain,,,
Gadsby Manan,@GadsbyMana92321,2024-01-21T10:34:47.000Z,Semakin yakin pak Ganjar pasti menang,,,
Callanan Hristo,@CallananH88335,2024-01-21T10:35:15.000Z,Gaspol pak Ganjar jadi yang terdepan,,,
Ogle Yancy,@OgleYancy91329,2024-01-21T10:34:19.000Z,Maju terus pak Ganjar pantang mundur,,,
Dia {I} AKU,@Hannis70324595,2024-01-21T09:30:32.000Z,"Ganjar Pranowo bener banget, internet itu bukan cuma hiburan, tapi juga sumber informasi dan pendidikan yang penting.",,,
Ridha Itamar,@ItamarRidh46321,2024-01-21T10:35:45.000Z,Hanya pak Ganjar idolaku pilihanku,,,
Hewitson Faustino,@HewitsonF66838,2024-01-21T10:31:03.000Z,Program pak Ganjar paling the best,,,
Ivanna Montserrat,@IvannaMont10270,2024-01-21T10:32:22.000Z,Pemimpin yang tepat pak Ganjar,,,
alissarahma,@AlisaDiah74422,2024-01-21T10:29:29.000Z,Mangatss terus presiden ku,,,
Tasyaaazr,@Tasyaazize,2024-01-21T10:30:51.000Z,Pak Ganjar capres terbaik pilihan rakyat,,,
𝖗𝖊𝖗𝖊,@retnooutammi,2024-01-21T07:57:27.000Z,"Semoga bapak diputaran kedua, gabung dengan 01 jgn diphp",,,
CYCLIST TRAVELLER,@denihartono513,2024-01-21T10:38:41.000Z,"Pak 
@mohmahfudmd
 jangan sungkan2 bantai habis si samsul",,,
Nadya sahaja,@NadyaSahaja,2024-01-21T09:33:05.000Z,"Respons Ganjar Pranowo menunjukkan bahwa dia punya pandangan jauh ke depan, memahami peran penting teknologi dalam kehidupan kita.",,,1.0
Jessica,@jessicamilaa0,2024-01-21T09:34:30.000Z,"Ganjar Pranowo keren, dia ngasih poin bahwa internet itu nggak cuma hiburan, tapi juga alat penting untuk kemajuan masyarakat.",,,
GreezLer,@GreezLerT,2024-01-21T10:03:54.000Z,Sumber informasi yang penting pada saat ini adalah internet. Pak Ganjar kembangkan terus internet untuk Indonesia,,,
KazumaaDey,@KzumaaDey_,2024-01-21T10:02:47.000Z,Internet adalah sumber komunikasi dan informasi yang penting pada jaman sekarang ini. Pak Ganjar kami selalu mendukung mu,,,
Staggs Mikaela,@StaggsM15484,2024-01-21T10:33:26.000Z,Selalu yakin pak Ganjar pemimpin paling dinanti masyarakat,,,
DexxAlyy,@DexxAlyy,2024-01-21T09:58:27.000Z,Pak Ganjar Mahfud terbaik pokoknya mahhh,,,
VinXyy,@VinnXyy_,2024-01-21T10:01:42.000Z,Internet adalah peluang ilmu yang besar. Lanjut kan terus pak kami mendukung mu,,,
Yallzz,@Yallzz__,2024-01-21T10:03:20.000Z,Dukungan selalu mengalir untuk mu pak. Tetap semangat dan pantang menyerah,,,
AlyyKeyy,@AlyyKeyy__,2024-01-21T10:01:08.000Z,Pak Ganjar sangat peduli kepada pendidikan teknologi dan edukasi warganya. Keren banget pokok nya,,,
RexxyyTzy,@RexyyTzyy_,2024-01-21T10:02:15.000Z,Wawasan yang luas selalu ada dalam diri pak Ganjar ini,,,
Rizaa Angg,@AnggRizaa,2024-01-21T10:09:07.000Z,Pak Ganjar tegas yah dan memikirkan sesuatu dengan sangat baik,,,
Haura Natash,@HauraNatash,2024-01-21T10:09:58.000Z,Maju terus pak Ganjar jangan gentar,,,
Kalista lista,@kalistastaa,2024-01-21T09:33:52.000Z,"Bener banget, Ganjar Pranowo nanggapin tantangan zaman dengan positif, internet itu pintu menuju dunia yang luas.",,,
Mamih Wt,@MamihWt,2024-01-21T10:09:38.000Z,Tetap Ganjar sihh program nya juga gk kaleng² semua berdasarkan kepentingan rakyat,,,
Dahnil A Simanjuntak,@Dahnilanzar,2024-01-21T07:24:13.000Z,"Agaknya isu pemakzulan dan inkondusifitas politik, delegitimasi terhadap Pak 
@jokowi
 adalah cara inskontitusional yg sedang disuarakan para pecundang yang tahu persis secara statistik Pak 
@prabowo
 dan Mas 
@gibran_tweet
 tak bisa dikalahkan. Dan dipastikan menang sekali putaran. Data telah terpapar terang, maka cari cara lain merusak arus besar dukungan rakyat Indonesia terhadap Prabowo-Gibran.",467.0,87.0,153.0
𝕯𝖚𝖗𝖊𝖓,@Duren___,2024-01-21T08:13:34.000Z,"Kalo dah ada adegan sujud sebelum waktunya, Mhn INFO ya ... Kami menunggu loh.. dah ga sabaran...
Btw, dg koalisi gemuk, hasil Surepay kok msh <50%??... Ayolah dipercepat, bisa buat hingga 70% kan??...",5.0,3.0,74.0
404-not found,@rektrektrekt123,2024-01-21T09:59:52.000Z,“Dipastikan” junawa,,,1.0
Bambang Feriyanto,@bferiyanto,2024-01-21T08:26:58.000Z,"Pemakzulan itu justru konstitusional bang, kalau kudeta baru inkonstitusional.

Kalau dibawah umur daftar capres dan lolos itu juga inkonstitusional, kecuali kalau dibajak paman MK bisa jadi konstitusional.

Demikian bang 
@Dahnilanzar
 mantan sekubu saya yang kemudian berhianat.",1.0,8.0,45.0
Kembar Jiwa,@KaraKenangan,2024-01-21T08:16:24.000Z,"Baperan sih pastiii
Awokwok...",8.0,11.0,24.0
Eko Putra,@EkoPutr86520727,2024-01-21T08:06:53.000Z,"Pemilih PS 2019 itu alergi dg jkw ..pasca PS nyebong apalg jdkan gibran cawapres 95% pemilih PS 2019 itu pindah ke 01 dan 03 smntra  suara pemilij jkw yg diharapkan PS terpecah hebat dg 03..suara dr mana yg menangkan 02 itu?
Suara siluman?
Atau hasil pat gulipat instrumen pemilu?",2.0,2.0,43.0
Amin Sumanto,@AminSumantoslow,2024-01-21T07:59:16.000Z,"Pemilu 2019, Prabowo-Sandi dapat suara 44%, Pak Jokowi-Makruf Amin dapat suara 56% seharusnya sekarang 100%, tapi mengapa hanya mentok 44%, ini artinya ada degradasi pada kepemimpinan rejim ini, ini akibat utang yang sudah mencapai 20.000 Trilyun, sudah melewati batas utang",,1.0,24.0
JokowiSenju,@JokowiSenju,2024-01-21T07:30:27.000Z,"Kasian banget sih pak bowo, udh 4x gagal nyapres, udh logistik segitu besar masih kalah",4.0,2.0,35.0
KUDA HITAM,@rudi_delcomm,2024-01-21T07:58:51.000Z,"Yang di-isu-kan Pak Jokowi harusnya kubuh Prabowo BIASA AJA kayak kubuh 01 dan 03
Jika tidak ada hubungannya dan dipastikan Presiden netral.

Kok Danhil yang kebakaran jidat.

EMANG ADA APA ?",4.0,2.0,69.0
Wiyono Hw,@WiyonoHw,2024-01-21T08:03:00.000Z,"Pilpres 2024 akan seperti  Pilgub Jakarta. Dimana Anies Baswedan selalu dikalahkan oleh lembaga survey. Tapi akhirnya  muncul sebagai pemenang. 
Bersiaplah dengan perubahan !!!",4.0,1.0,62.0
Dahnil A Simanjuntak,@Dahnilanzar,2024-01-21T07:24:13.000Z,"Agaknya isu pemakzulan dan inkondusifitas politik, delegitimasi terhadap Pak 
@jokowi
 adalah cara inskontitusional yg sedang disuarakan para pecundang yang tahu persis secara statistik Pak 
@prabowo
 dan Mas 
@gibran_tweet
 tak bisa dikalahkan. Dan dipastikan menang sekali putaran. Data telah terpapar terang, maka cari cara lain merusak arus besar dukungan rakyat Indonesia terhadap Prabowo-Gibran.",476.0,87.0,154
𝕯𝖚𝖗𝖊𝖓,@Duren___,2024-01-21T08:13:34.000Z,"Kalo dah ada adegan sujud sebelum waktunya, Mhn INFO ya ... Kami menunggu loh.. dah ga sabaran...
Btw, dg koalisi gemuk, hasil Surepay kok msh <50%??... Ayolah dipercepat, bisa buat hingga 70% kan??...",6.0,3.0,79
404-not found,@rektrektrekt123,2024-01-21T09:59:52.000Z,“Dipastikan” junawa,,,1
Bambang Feriyanto,@bferiyanto,2024-01-21T08:26:58.000Z,"Pemakzulan itu justru konstitusional bang, kalau kudeta baru inkonstitusional.

Kalau dibawah umur daftar capres dan lolos itu juga inkonstitusional, kecuali kalau dibajak paman MK bisa jadi konstitusional.

Demikian bang 
@Dahnilanzar
 mantan sekubu saya yang kemudian berhianat.",2.0,9.0,54
Kembar Jiwa,@KaraKenangan,2024-01-21T08:16:24.000Z,"Baperan sih pastiii
Awokwok...",9.0,12.0,27
Eko Putra,@EkoPutr86520727,2024-01-21T08:06:53.000Z,"Pemilih PS 2019 itu alergi dg jkw ..pasca PS nyebong apalg jdkan gibran cawapres 95% pemilih PS 2019 itu pindah ke 01 dan 03 smntra  suara pemilij jkw yg diharapkan PS terpecah hebat dg 03..suara dr mana yg menangkan 02 itu?
Suara siluman?
Atau hasil pat gulipat instrumen pemilu?",2.0,2.0,45
Amin Sumanto,@AminSumantoslow,2024-01-21T07:59:16.000Z,"Pemilu 2019, Prabowo-Sandi dapat suara 44%, Pak Jokowi-Makruf Amin dapat suara 56% seharusnya sekarang 100%, tapi mengapa hanya mentok 44%, ini artinya ada degradasi pada kepemimpinan rejim ini, ini akibat utang yang sudah mencapai 20.000 Trilyun, sudah melewati batas utang",,1.0,25
JokowiSenju,@JokowiSenju,2024-01-21T07:30:27.000Z,"Kasian banget sih pak bowo, udh 4x gagal nyapres, udh logistik segitu besar masih kalah",5.0,2.0,35
KUDA HITAM,@rudi_delcomm,2024-01-21T07:58:51.000Z,"Yang di-isu-kan Pak Jokowi harusnya kubuh Prabowo BIASA AJA kayak kubuh 01 dan 03
Jika tidak ada hubungannya dan dipastikan Presiden netral.

Kok Danhil yang kebakaran jidat.

EMANG ADA APA ?",4.0,2.0,69
Wiyono Hw,@WiyonoHw,2024-01-21T08:03:00.000Z,"Pilpres 2024 akan seperti  Pilgub Jakarta. Dimana Anies Baswedan selalu dikalahkan oleh lembaga survey. Tapi akhirnya  muncul sebagai pemenang. 
Bersiaplah dengan perubahan !!!",4.0,1.0,65
% orang merdeka,@nurdinyanto18,2024-01-21T10:26:42.000Z,"Yg ngomong nya netral tapi cawe2,bayangkan yg bisa di lakukan  buat sang anak manja,aturan di babat,ya wajar lah isu itu muncul",,,
Mulai jelas,@taliwongsooo,2024-01-21T07:39:04.000Z,"Memangnya tanpa cawe² Presiden 
@jokowi
 Prabowo sudah pasti kalah ya? Sptnya kok ketergantungan sekali.

Payah memang kalau jompo al jomblo.",,,10
Perindu Keadilan for Semua,@ayah0990,2024-01-21T10:14:09.000Z,"Mohon maaf bang, saya sekedar mengingatkan agar berhati-hatilah dlm berstatemen, JANGAN JUMAWA, betapa banyak kisah-kisah org jumawa yg ditenggelamkan oleh Allah.

Semoga kita semua diampuni segala dosa dosa kita oleh Allah. Aamiin",,,1
Erik Fernandes,@ErikFer90452405,2024-01-21T09:35:41.000Z,Satu Putaran for 1 Anies & Muhaimin supaya Indonesia Adil Makmur...Yess,,,
𝐍𝐜𝐚𝐧𝐠 𝐖𝐚𝐰𝐚𝐧,@Ridwan1924,2024-01-21T10:10:18.000Z,"Wah kurang baca nih orang...

Pemakzulan tu konstitusional ada undang2nya, dan hak rakyat juga untuk menuntut... knapa takut banget jokowi di impeach ? 

Kalo gitu bener dong 02 itu dompleng jokowi...tanpanya prabowo pepesan kosong....ente yg pecundang kalo gitu..blajar lagi gih.",,,1
464M,@FiNfie777,2024-01-21T09:55:53.000Z,"@Dahnilanzar
 ,Pemakzulan inskonstitusional?Ada bukti pendukung. Lalu apa yg di banggakan dr Prabowo selain pelanggar HAM,terindikasi Korupsi dgn proyek Food Estate!Dimana tanggungjawab rusaknya hutan?Dan Lihat keputusan MKMK ttg Gibran,anak haram konstitusi.Kau yg Pecundang!!!",,,4
Nasi Gandul,@NasiGandul1,2024-01-21T09:29:15.000Z,Orang yg dekat dan dalam lingkaran pengkhianat konstitusi memang tak punya nurani lagi jadi matanya buta thd kecurangan yg kasar mata,,,
Budak_Sunda,@Moch_Denza,2024-01-21T09:19:42.000Z,"Syah"" saja Pak Jokowi di makjulkan jika sesuai dengan perintah UUD, asalkan memenuhi syarat.

Otak eloh sengklek ya, jelas"" cawapres eloh yang cacat, demi meloloskan mengirbankan sang Paman.cacat Etika Di MK. Makanya sang Paman di PECAT.",,,4
andykeren1234,@andykeren123456,2024-01-21T10:41:46.000Z,Kalau ada yg kalah jgn mau demo seperti 22 mei 2019.. kalian mati.. mereka yg dia atas tertawa terbahak2,,,
nello17,@mr_nello17,2024-01-21T10:14:18.000Z,Udah mulai goyang ya bro? Klo memang isu ya ndak usah ditanggapi wong udh 50% lebih koq disuvey tp masih takut aja.. hahahaha,,,
kamal,@kamaloeby,2024-01-21T10:10:19.000Z,"Yakin gw bro,kalah prabowo asal jkw jgn cawe2. Cm krn dia sdh ungkapkan akan cawe2 makany ada indikasi  kekuasaan jkw digunakanny utk memenangkan anaknya",,,
Aulia Izzatunisa,@AuliaIz59345122,2024-01-21T08:05:09.000Z,"Ya ga PP lah pa, namanya juga opini, dulu ada opini juga 2019 ganti presiden yo dak papa,bebas to, ko jdibdipikirin dan dibahas apa memang peluang nya lebih besar ya pa?",,,
Prof. Dino,@ProfDino10,2024-01-21T09:39:56.000Z,orang orang seperti anda justru yg merusak nama prabowo di mata saya,,,
Bg San1,@bg_san1,2024-01-21T10:25:41.000Z,"Meski di isu kan terus prabowo menang, kami tetap tidak akan memberikan suara kami ke Prabowo.",,,
Wong Lemit,@budaklemit,2024-01-19T13:26:33.000Z,TIMNAS AMIN TEMUKAN 54 JUTA DPT BERMASALAH. ADA PEMILIH BERUSIA DI ATAS 1.000 TAHUN!,2,6,16
SuaraPerubahan1,@herlambang1966,2024-01-19T15:35:43.000Z,"kode alam,",,1,8
Joko Pebrianto,@pebriantoj26,2024-01-20T13:32:41.000Z,Kalo lu lu pada bisa berfikir jernih kenapa itu kamera udah nyorot duluan? Kalo dari cctv sih bagus lah jni udah di rekam pasti udah ada sobekan lah ,,,1
BimoSaputro,@ABimoSaputro,2024-01-20T00:03:10.000Z,"Iya bg di tempat gw spanduk samsul banyak bener sampe mbatin sebel krn kezoiman mrk sambil doa dlm hati supaya diturunkan alam,eh pas ujan gede pada ambuk semua termasuk baliho yg ada khoifiah balihonya ganjar sama anies msh ada cuma baliho 02 yg rata2 pd putus sendiri....",1,1,3
pinkyyy,@dipssiiy,2024-01-19T04:41:52.000Z,"ginian aja gue ngakak plisss, bahkan semesta aja memunculkan abah",2,,8
Mr. NoBody,@MrNoBod99224703,2024-01-19T06:42:53.000Z,"Ini angin bisa2 dipidanakan tuh, sama spt kawan kita ini yg dibungkam dan dipidanakan spt di tweet ini... Eh lupa betul kata abah 
@aniesbaswedan
 angin gak punya KTP",,2,7
velina,@velinaa21,2024-01-20T00:08:30.000Z,"Seandainya pun Anies belum rejeki menang,saya tidak akan pilih Prabowo",,,
Anish Goodall,@anisajoddie,2024-01-20T00:09:56.000Z,Sedih sekali masih ada pihak yang tidak bertanggung jawab akan hal tersebut,,,
Tenzin Moreton,@Moretadiah,2024-01-20T00:09:15.000Z,Alam pun ikut marah dan menunjukkan kekuatan nya bahwa tidak ada yang bisa menutupi,,,
huma,@SitiA7135,2024-01-20T00:07:07.000Z,"Wehehe itu lah alasan menolak keras Paslon 2 , tuhan tau mana yang amanah dan tidak",,,1
Amin Aman,@AminpastiAman,2024-01-19T08:42:50.000Z,Optimis AMIN menang #AminPalingSiapUntukIndonesia,,,
Sadam Ster,@Sadamnisaa,2024-01-20T00:10:45.000Z,Alam saja merestui anies pemimpin Indonesia,,,
desta,@destabela,2024-01-19T15:56:55.000Z,Katanya alam memihak Prabowo lah ini buktinya alam lebih dukung Anies ko,1,,2
Milana Langton,@laina_mila,2024-01-20T00:11:25.000Z,Inilah buktinya kuasa Allah itu nyata,,,2
Doolley Dam Dam,@DamDoolley,2024-01-19T06:19:45.000Z,"Keren sih ini, mau itu bener terjadi atw editan video bisa jd bahan counter atas ejekan wan angin dr parsoc dkk. Mrk harus masuk bunker bawah tanah klo pengen selamet dr badai yg nyamperin ke mrk.",1,,3
Seno darmadi,@yandarmadi1314,2024-01-19T20:12:25.000Z,Baleho itu bayat pajak. KLO ga bayar ya ditutup aja.   Gitu aja repot,,,
zeusarkana,@zeusarkana,2024-01-19T22:21:29.000Z,Lihat alam pun mendukung pak Anies Baswedan,,,
Dara sita,@darasita83,2024-01-19T21:35:38.000Z,"Pilih Anies untuk memastikan keamanan dan stabilitas, karena Prabowo cenderung kontroversial",,,
Rosi vantika,@RosiVantika,2024-01-19T21:31:35.000Z,"Saya melihat Anies sebagai pemimpin yang bisa menghadirkan inovasi, tidak seperti Prabowo",,,
Nicaaa,@Nicaaa_sz,2024-01-19T21:39:35.000Z,"Pilih Anies untuk menjamin hak-hak perempuan, sesuatu yang kurang diperhatikan oleh Prabowo",,,
Lona Parker,@LonaParker_,2024-01-19T22:07:41.000Z,"Pilih Anies untuk masa depan yang lebih cerah, karena Prabowo tidak memiliki rekam jejak yang kuat",,,
"Golput No, AMIN Yes",@indra7488,2024-01-20T00:10:47.000Z,Kode alam Pak Anies Presiden RI 2024...AMIN,,,
zandrarefo,@zandrarefo,2024-01-19T22:18:12.000Z,"Anies Baswedan memiliki visi yang jelas untuk memajukan Jakarta, lebih baik daripada Prabowo",,,
Bulanmoon7,@Bulanmoon__,2024-01-19T21:42:34.000Z,"Saya mendukung Anies karena komitmennya terhadap lingkungan, hal yang minim diperhatikan oleh Prabowo",,,
ᵈᵃʳᵗⁱʷⁱ,@dartiwibtcs,2024-01-19T05:39:31.000Z,"Percayalah, lusa tim kuasa hukum Te Ka eN bakal melaporkan si angin ke baleskrim dengan tuduhan dugaan perbuatan tidak menyenangkan",,,2
Malioboro Art Galery,@MalioboroG,2024-01-19T23:06:12.000Z,sudah ada isarat kayaknya saya ke Amin aja,,,
Attapulgite,@Attapulgiit,2024-01-19T22:09:15.000Z,"Anies Baswedan adalah pemimpin yang peduli dengan kebutuhan rakyat, bukan hanya janji politik semata",,,
ولا الضالين امين,@LombokRumy,2024-01-20T00:57:19.000Z,Ntar ada yg mau nyalahin angin,,,
Elangputra,@Elangputra_,2024-01-19T21:50:14.000Z,"Pilih Anies untuk keberlanjutan pembangunan, karena Prabowo belum membuktikan kemampuannya",,,
Cantika,@Cantikaax_,2024-01-19T21:44:53.000Z,"Pilih Anies untuk mewujudkan pemerintahan yang bersih dan transparan, tidak seperti Prabowo",,,
BONO ADDICT,@eckovai,2024-01-20T01:55:56.000Z,Aya2 wae wan abud tukang ngibul raja bacot,,,
Ziyya,@Ziyya129,2024-01-19T12:05:59.000Z,Dukung prabowo jadi rakyat aja kalo jadi pemimpin ga dulu,,,3
Adipati Karno,@adipat1_karno,2024-01-19T19:40:23.000Z,"Bentar lg ada narasi pembelaan "" baliho ilegal/belum ijin/belum bayar.. blablaba...",,,1
Mr tap,@mr47470,2024-01-19T16:39:42.000Z,Yg suka koar2 wan angin mana niih lihat tuh angin sudahemberi kode pada pak anies,,,1
Sipun namantana,@SNamantana,2024-01-19T11:36:52.000Z,Rapatkan barisan untuk slalu mendukung kemenangan pak anis,,,2
Bumiali,@Bumiali1,2024-01-19T11:21:55.000Z,"Pak anis memang pantas untuk jadi pemimpin,semua sudah ditakdirkan",,,1
Ondalandel,@ondalandel,2024-01-19T11:38:08.000Z,"Karna yg terbaik memang cuma pak anis,alampun setuju akan hal itu",,,1
ORANG TANGERANG,@evan120488,2024-01-19T05:17:00.000Z,Pendung 02 bisa bikin begini gak,,,5
Adi Perseta,@PersetaAdi,2024-01-19T03:52:44.000Z,"Kuasa Allah SWT memang diatas segala-galanya. 

#AniesDeservesBetter 
#PahitManiesAlwaysWithAnies",,,4
Not a Hotman,@ari_rezaa,2024-01-19T05:58:17.000Z,Lucu emg komenan orang2 ttg video yg kek gini,,,1
Areka,@Areka_88,2024-01-19T11:31:18.000Z,Semua udh tau klo pak anis yg pantas untuk menjadi pemimpin,,,1
shezan,@shezan2424,2024-01-19T15:37:34.000Z,"Alam juga tau yang Amanah dan bertanggung jawab, jelas bukan Prabowo",,,2
Agni,@agninazera,2024-01-19T16:11:34.000Z,"Pendukung paslon 02 artis papan atas, tapi pendukung paslon 01 alam itu sendiri, bisa apa Paslon 02",,,1
asha,@ashahasri,2024-01-19T15:46:07.000Z,"Lagian niat amat nutup baliho AMIN jadi percuma kan di buka juga sama Angin , pilih no. 01 tidak no. 02",,,1
LOE GWE AJA...,@Cuexbe2k,2024-01-19T02:43:45.000Z,"Anginpun mengerti,siapa yg pantas memimpin Negeri...",,,10
mnuzultommy,@mnuzultommy,2024-01-19T09:38:12.000Z,"Itu suara angin kl kedengeran bunyinya, ""sompret! Jangan licik dong!",,,1
Harisa FP,@harisafp,2024-01-20T06:33:52.000Z,"Wess wayahe ... sudah waktu nya buat perubahan ya guys.
Bismillah.",,,
Topatul,@topatul,2024-01-19T09:32:16.000Z,Karna memang pak anis yg bisa menjadikan Indonesia maju,,,1
Putualun,@putualun,2024-01-19T11:35:08.000Z,Dukung trus pak anis yg memang terbaik untk rakyat dan negara,,,1
nayya,@tnayya_,2024-01-20T00:12:50.000Z,Semua tahu mna yang terbaik,,,
Kabar Baik,@CoronaTV6,2024-01-19T16:52:29.000Z,Terbukti wan angin bisa kendalikan angin.. angin perubahan,,,1
ayrindi,@ayrindi7,2024-01-19T15:41:19.000Z,"kalau Alam saja udah kasih kode AMIN itu pasti yang terbaik untuk rakyat, say no untuk Paslon 02",,,2
Aziz,@MasDriver18,2024-01-19T06:07:47.000Z,Sehebat apapun kejahatan pasti Kebongkar juga..,,,1
Gudeg Jogja,@GudegJogja17,2024-01-19T22:37:17.000Z,Angin ajah dukung Anies,,,
Poki,@pororopororong,2024-01-19T15:33:53.000Z,makin yakin pilih AMIN ,,,1
sentot,@Sentot38458930,2024-01-20T09:57:39.000Z,eehh..pak RT,,,
iban,@ibaninabi,2024-01-19T15:28:58.000Z,"kalo gini lapor siapa yaa, semuanya udah ga bisa dipercaya",,,1
@sundari69,@sundari69,2024-01-19T18:06:03.000Z,Insalloh Indonesia dapat presiden yang mamah 2024 Anis Rasyid Baswedan,,,2
Ganden,@Ganden82,2024-01-19T09:28:32.000Z,Kami semua sangat mendukung pak anis apapun yg terjadi,,,1
Fedayen Alqowasi,@khowasi,2024-01-19T15:00:34.000Z,Angin akan di laporkan ke bawaslu krn merusak baliho,,,1
Mr tap,@mr47470,2024-01-19T16:38:59.000Z,Anjay itu ygvpunya pajak baliho dapat doble,,,1
Zakii,@Zakii295,2024-01-19T11:59:18.000Z,Prabowo di takdirkan untuk jadi capres aja selamanya,,,1
Diandra,@Dian_dr_a,2024-01-19T09:22:46.000Z,Cuma pak anis yg mampu untuk memimpin Indonesia,,,1
adlin,@adlintwit,2024-01-19T15:27:50.000Z,"banyak banget yang menyalahi AMIN, tapi kita harus tetap maju, jangan gentar!",,,1
Ashava,@ashavaputrii,2024-01-19T16:10:09.000Z,Angin said : sory Paslon 02 gue lebih pilih yang amanah Paslon 01 aja,,,1
Zelaa,@Zelaa433,2024-01-19T11:55:15.000Z,Semakin yakin untuk tidak mendukung prabowo,,,1
Edi,@edidj49,2024-01-19T06:46:13.000Z,"Kebusukan mereka  dinampakkan
Oleh yg maha kuasa...
Kebaikan akan menang",,,2
maszidil harom,@maszidil_harom,2024-01-19T16:46:27.000Z,Kode alam nih...smoga saja Pak Anies menjadi presiden,,,3
Syafiqq,@Syafiqq76,2024-01-19T12:04:28.000Z,Mari kita mendukung prabowo jadi rakyat,,,1
Martha,@Martha9_68,2024-01-19T09:34:10.000Z,Pada kenyataannya pak anis lah yg terbaik untuk negara,,,1
sri_les10,@sri_les10,2024-01-19T15:35:32.000Z,"Katanya Alam dukung Prabowo, jelas2 Alam dukung Anies loh ",,,1
Feryglow,@Feryglow2,2024-01-19T09:19:54.000Z,Semua juga mendukung kemenangan AMIN,,,1
