UserName,Handle,Timestamp,Text,Comments,Likes,Retweets
ELWAA,@elwaa__,2024-01-19T02:37:04.000Z,"1 sama 2 kok bareng terus tempatnya ya?
9 Feb sama2 di Jatim, mana deketan.
10 Feb sama2 di DKI",,,
Ky,@rbagoes_,2024-01-19T08:11:25.000Z,Jawa adalah koentji,,,
K.Madrid,@MadridKak,2024-01-19T01:09:17.000Z,mak banteng gk maratu mahakarya bokap nya dipakai buat papigemoy ? curiga mak banteng demen papigemoy,,,
caramel berry latte,@syaif38,2024-01-19T05:53:44.000Z,Semuanya di Jawa ,,,
Moch yusuf Dharmawan,@dharmawan_moch,2024-01-19T05:59:58.000Z,Mending duit kampanye dipake bikin pabrik kerupuk.... Sayang duit kalo kata aing mah,,,
gondrong,@satyanisme,2024-01-19T08:42:45.000Z,Cet cet maceeeettt ,,,
Bim Soo Ho,@HajiiiiB,2024-01-18T12:40:52.000Z,macet kebayang,,,1
sal,@heiiidude,2024-01-19T09:21:56.000Z,Menarik,,,
ㅡ,@inditabcde,2024-01-19T02:34:45.000Z,Jawa adalah koentji,,,
Ahmad Dandi Subhani,@dandisubhani_,2024-01-19T00:35:18.000Z,njir GBK 2.0,,,
jamrud,@Mustiko01827550,2024-01-19T00:38:42.000Z,01&02 kampanye di jakarta ngeri2 sedep mudah2an lancar ga ada chaos,,,
Faisal Amar,@faisalamar_11,2024-01-19T06:53:56.000Z,"Keren sih pemilihan tempatnya, terlihat filosofis banget",,,
Tokoh ilusi,@razordice,2024-01-19T06:11:16.000Z,setiap anies kampanye ada wowo ikut2n kampanye disitu ,,,
aku cuman pohon,@octoberscale,2024-01-19T01:49:09.000Z,YAK SIAP-SIAP MACET ,,,
Muhammad Alfin | Digital Marketer,@alfinestaa,2024-01-19T11:01:51.000Z,"Gw tertarik dengan strategi 01 buat pilpres putaran pertama kali ini. 01 tau betul, Jateng bukan kandang dia. 01 ""mempersilahkan"" 03 buat menang di kandang sendiri. Dan 01 fokus di Jatim, y.i basis NU dan cak Imin dan jabar DKI y.i basis pak Anies. Keren!",,,
GANJRA PRAWONO,@Soegijo_,2024-01-19T06:21:49.000Z,JAWA JAWA JAWA,,,
Voila,@vaiyo,2024-01-19T13:59:19.000Z,"Gak fair nih, launchingnya di Up Normal tapi namanya Forum Anomali...
Anyway, sukses dg forumnya dan segera menular ke kampus² lainnya utk sama² merawat demokrasi Indonesia, mengembalikan pada tracknya, jangan sampai regresi! ",,,1
Yanti,@DS_yantie,2024-01-19T07:42:43.000Z,"Mantap, semoga sukses terus bang.",,,12
b3'doel,@B3doel___,2024-01-19T10:21:05.000Z,"Kami di belakangmu, kawan

Teruslah perjuangkan hak demokrasi.",,2,7
diyon mandiri,@DiyonMandiri,2024-01-18T15:05:25.000Z,coba gerakan mahasiswa buat kawal suara di TPS bung..bikin gerakan apa gitu..pasti solid kalo mahasiswa udh bergerak..lawan ketidakadilan dan kecurangan pesta demokrasi..,19,50,681
pagandeng,@olink1978,2024-01-18T14:38:23.000Z,"dulu kami sering dengar tentang peran mahasiswa sebgai agent perubahan & sosial control....entah hari ini.
ketika pemilu th 99, banyak mahsiswa terlibat sebagai pemantau pemilu guna membantu memastikan penyelenggaraan pemilu yg jujur & adil.",2,11,222
Ramin (R - AMIN),@Radjahoki_pro,2024-01-18T19:22:45.000Z,"Panjang umur Perjuangan 
Tetap jaga idealisme dan konsisten membela yg baik dan benar dimanapun kapanpun.
Saat sudah di puncak nanti, jangan ikuti jejak mereka, karena Cuan hilang sudah akal sehat. 
#snow #GenZ",2,17,93
Cak_Sabri,@CakSabri1,2024-01-18T16:10:19.000Z,"Kadang hati berdebar2: siapa di belakang kalian, anak2 muda? Banyak senior dan seangkatan kalian sdh terkubur, perjuangannya luntur oleh materi atau kenikmatan duniawi. Kalau hanya utk mencari keuntungan materi, sebaiknya gunakan cara lain. Atau coba buktikan kalian mmg petarung!",4,4,77
ArekSosmed,@areksosmed,2024-01-18T16:26:55.000Z,"Hai anak muda generasi bangsa, bikinlah gerakan kawal TPS, Pasti sangat keren gerakan ini apabila mahasiswa mau turun mengawasi jalannya PEMILU di tiap TPS...Untuk meminimalisir terjadinya kecurangan PEMILU...Sekedar input aja seh ini ",1,3,41
Edwines31,@edwines31,2024-01-18T14:42:39.000Z,"berjuang sekeras kerasnya dan berjuang sehormat hormatnya !

percayalah, anda sekarang berada di jalan yang benar, tidak usah takut ancaman buzer, kami netizen yang masih waras dan punya hati nurani akan selalu berjuang bersama anda !!",,1,102
tunjung utomo,@tunjungutomo,2024-01-18T15:48:32.000Z,"Gini dong. Bangkitlah mahasiswa Indonesia!! Kembali jadi kekuatan intelek pembela mereka yg suaranya tak didengar 
.
.
Jd pengen nyanyi “kepada para mahasiswa yg merindukan kejayaan”. Megafon mana megafon",,,29
Balola,@zenondown,2024-01-18T17:28:53.000Z,Allhamdullillah Ade2 Mahasiswa masih banyak yg peduli Dengan demokrasi di negara tercinta ini.,1,18,73
negeri para pembohong,@HRubbina,2024-01-18T14:26:19.000Z,,,,
cilox ✪,@ecilox,2024-01-18T16:28:16.000Z,"Kenapa ga si Warkop nya bang 
@Fahrihamzah
 biar seruput kopi beliau bang..  konon brand kopi revolusinya terinspirasi dari semangat pergerakan warung kopi.

Apa kopi beliau dah berubah jadi kopi gemoy ?? ",1,,
aydaruusy,@aydaruusy14ulu,2024-01-19T00:46:15.000Z,"Aku saran.. Demi merawat demokrasi di negara ini tolong kalian lengserkan jokowi segera !! Kasihan rakyat banyak yg gak melek politik, yg gak sadar kl slm jokowi memimpin RI tambah banyak masalah yg dibuat & ujungnya akan menghancurkan kesejahteraan kerukunan rakyat",1,,2
Garely,@DermagaGarely,2024-01-19T01:57:22.000Z,"jangan kasih tau si faldo maldini 
@FaldoMaldini
 .... bisa ke salon rebonding dia nanti...",,,
Johny,@johhhhnygudhel5,2024-01-18T19:00:18.000Z,Terimakasih ,,,1
Bocah kampung,@Naditean03,2024-01-18T23:13:31.000Z,Teruslah berjuang ,,,
Totok Adhy Yanto,@tokadhy,2024-01-18T23:23:25.000Z,Lawan Politik Dinasti...,,,
yanuar,@yanuarabadi33,2024-01-18T20:23:31.000Z,Gas bang,,,
NowisNiel,@shanshine0n,2024-01-18T18:00:34.000Z,"Respect, i support all of u",,,
BIELDIEF,@aa_nabiel,2024-01-19T10:26:29.000Z,"Di era era sebelumnya, mahasiswa selalu menjadi agent perubahan dan social control baik demokrasi ataupun pemerintahan.
Tetapi saat ini semangatnya mulai pudar, ada apa dengan mahasiswa?",,,
CAKRANINGRAT,@gorogoro2024,2024-01-19T10:14:15.000Z,"Ayo anak muda , banyak media bisa kalian gunakan saat ini buat memperbaiki kondisi Demokrasi Indonesia yang sedang sakit dan dicabik cabik kalian tidak perlu mengalami ""KUDATULI"" seperti kami , bersuara lah dan bertindak. 

#MahasiswaBergerak",,,
catch23,@Dhayatrahim2303,2024-01-19T03:07:23.000Z,Salut...,,,
Ozilia7,@bungakattes,2024-01-19T10:28:35.000Z,"Kasih paham, soal nya kebanyakan yg milih tuh ga tau tentang paslon2, cuma ikut²an aja, mari cerdaskan pemilih",,,
henymenik,@henymenik1,2024-01-19T09:16:17.000Z,Alhamdulillah semangat ,,,
JustRoe',@RoeMarley69,2024-01-18T14:50:11.000Z,mangat bunggg!,,,1
mamakbangsa,@mamakbangsa,2024-01-18T22:28:37.000Z,Hidup Mahasiswa!,,,
Hilman Arta Wijaya,@hilmanarta,2024-01-19T05:27:29.000Z,"*mode komen tiktok*

Ga ngaruh tetap all in Prabowo",,,
riEzzzz,@rieztinacubby,2024-01-19T10:17:35.000Z,Semangat adik adik mahasiswa!!!!!,,,
mirza,@mirzanjing,2024-01-19T03:13:37.000Z,Kalau dalam prosesnya dan tujuannya cma untuk mendukung atau menaikan elektabilitas salah satu paslon siapapun itu.. ga usah pake label merawat demokrasi ya kaka kaka mahasiwa.. merawat demokrasi itu tajam kepada siapapun paslonnya yaa.. kalau melanggar dan salah ya kritik semua,,,
iJaleho,@Okajaya,2024-01-19T06:58:28.000Z,Omon omon,,,
GOMEN||,@KARINILOVEU,2024-01-18T17:20:09.000Z,"coba bikin tulisan dong, mau tau isi kepala ketua2 bem gimana.",,1,
RontokanPeyek.,@Joni1443,2024-01-18T17:03:30.000Z,Panjang umur perjuangan ,,,
Nggak pengen dikenal apalagi terkenal,@auriel_septim,2024-01-18T23:48:31.000Z,Fire up ,,,1
SimplePerson,@Pakiwan740418,2024-01-19T00:19:50.000Z,"Gerakan kawal pilpres jujur dan adil,mari kita songsong Presiden Indonesia ke-8 dari hasil pilpres yang Jujur,Adil tanpa intimidasi.Jadikan Indonesia negara Demokratis yang Maju yang berkeadilan dan Sejahtera.",,,
Emoh Baper,@senyuuumdoong,2024-01-19T01:31:35.000Z,"Adek adeku , pesan ya nanti kalau sdh naik ke Jakarta ,masuk parpol , ke senayan atau jd Pejabat jangan hanya jd 'kacung' tapi jadilah perubah buat kebaikan di NKRI jadilah warna lain kebaikan bkn hanya pengumpul harta 
Didoakan Kalian bs jd kebaikan buat Bangsamu",,,
jagkli,@caloproperty,2024-01-19T09:30:24.000Z,"Mau ngapain ada grombolan anomali?
Intropeksi kalian dulu dah...!
Masak ngga paham seh...?",,,
Harry Khan,@haris_polmen,2024-01-19T00:32:25.000Z,Lawan anak haram reformasi dan anak haram demokrasi berkuasa.,,,
Dean Harish,@DeanHarish,2024-01-18T15:27:40.000Z,,,,
Kaji Taufan,@kajitaufan,2024-01-19T02:15:27.000Z,Semoga sukses ,,,
aleena,@alenaaanam,2024-01-19T00:36:36.000Z,Alahmdulillah  semoga akan makin banyak anak anak muda yg peduli dan mengikuti jejak ade ade ini tetap berjuang dan semangat doa kami menyertai perjuangan kalian,,,
GPD,@g_dawg46,2024-01-19T04:38:47.000Z,"kumpulan org ga lulus kuliah. karena kalo ud lulus, masuk dunia nyata, gajadi apa2",,,
Bramaz,@GusBramas,2024-01-19T11:08:55.000Z,Kapan ya bisa liat jokowi di pecat,,,
manorsa_eddyslpurba,@ddy_margind,2024-01-19T01:11:38.000Z,Tunjukan jati dirimu pd dunia dan jaga demokrasi Indonesia,,,
TM,@aryawijaya2006,2024-01-19T03:03:00.000Z,"Selamat berjuang untuk pejuang muda dengan militansi tinggi tidak pernah mundur 1 langkah, tidak pernah takut diintimidasi dan di intervensi, salam Demokrasi buat pejuang muda menuju Indonesia emas.",,,
jamez,@jamez4160994176,2024-01-19T14:21:04.000Z,Terus suarakan kebenaran dan keadilan,,,
angkasa | ambersuara,@azuraamcz,2024-01-18T15:09:33.000Z,"AAAKHIRNYAAA, KAMI DUKUNG KALIAN KAKKK SEMANGAT JANGAN GENTAR!",,,
Cadastral Knight,@JeEsSandy,2024-01-19T04:33:17.000Z,Tetap konsisten dlm berjuang dan jgn pernah kalian tergelincir dari idealisme kalian di kemudian hari,,,
mat koplak,@matkoplakaje,2024-01-19T02:50:50.000Z,kawal terus demokrasi kita ,,,
kokokoko,@koko_yuliarta,2024-01-19T04:45:35.000Z,"1. r soekarno
2. oeharto
3. J Habibi
4. bdurahman wahid
5. oekarno putri
6. ambang yudhoyono
7. okowi
8. aswedan
9. emoy
10. rry ye.. sorry ye...",,,
royfatanen,@fatanenroy,2024-01-18T20:57:12.000Z,"Ayo bung bung muda penerus bangsa tunjukan kalian mahasiswa itu ada, jadikan momentum ini adalah kebangkitan mahasiswa indonesia yg tanpa pamrih melawan kerakusan kekuasaan dinegeri ini. Mahasiswa tidak bisa dibohongi, mahasiswa berjalan dikakinya sendiri.",,,1
,@kembarkln,2024-01-19T01:39:43.000Z,"Semangat adik2..
Alhamdullilah masih banyak anak2 muda yg peduli untuk terus merawat negeri ini",,,
sambel ijo,@_bangagoengDuA,2024-01-19T09:56:19.000Z,"Ayo kapan kalian bergerak,, udah jelas² konstitusi dikangkangi kalian masih diam saja...",,,3
Ahmad Saepudin,@AhmadS_NU,2024-01-18T15:54:41.000Z,Jadilah Agen perubahan yang rasional,,,1
,@radeakarna,2024-01-19T05:29:49.000Z,saya sangat menaruh harapan gerakan kalian. selamat berjuang!,1,,
Om Tatiiiiissssssss.........,@SutrisnoTrisen,2024-01-19T07:31:55.000Z,Maju terus anak muda. Tetap suarakan kebenaran di saat kebanyakan orang2 tua pura2 tuli dan buta akan kondisi negara saat ini..,,,1
Channie,@disekitarmu___,2024-01-18T16:28:40.000Z,"HIDUP MAHASISWA, HIDUP RAKYAT INDONESIA ",,,
Nur MH,@andemha67,2024-01-18T21:06:37.000Z,Teruslah bersuara kritis membela rakyat yg lemah dan dilemahkan. Siapapun presidennya.,,,
ArminArlert,@AfifudinBa70250,2024-01-18T23:16:22.000Z,"Sebar luaskan ke mahasiswa mas, agar tgl 14 Februari 24 menggunakan hak pilihnya. Tks.",,,
User,@esipede,2024-01-19T04:59:01.000Z,kekerasan seksual apa kabar hey..,,,
noneee,@rubyrider70,2024-01-18T23:29:29.000Z,"Maju terus nak harus ada yg berani seperti kalian,begitulah dulu pak Anies waktu msh muda seperti kalian.kalianlah harapan kami utk menyuarakan perlawanan terhadap rezim ugal2an ini.bawa temanmu yg blm tergerak.negri ini hrs segera diselamatkan dr tangan2 kotor penguasa tdk th dr",,,5
danielza,@danielza333,2024-01-19T03:50:57.000Z,Usul.. Ada gerakan urk mengawal perhitungan suara dari mulai TPS sampai nasional yg dapat dijadikan data pembanding yg kredibel.. Dgn hasil yg dianggap resmi. Utk menjaga seandainya ada Indikasi kecurangan,,,
ul,@AdekUL30,2024-01-18T17:28:09.000Z,Keren Dinda. Kalian adalah masa depan bangsa yg menjadi tonggak penjaga demokrasi. Di tangan kalian lah bangsa ini berharap akan masa depan yg lebih baik. Jangan takut LAWAN KECURANGAN & KETIDAKADILAN. Proud of You  Mahasiswa,,,
rumah_kita,@rumah1945,2024-01-19T03:11:41.000Z,"Demi kebaikan demokrasi negeri ini trs semangat, kita tdk tahu mungkin kelak satu diantara kalian akan menjadi pemimpin yg baek dan membawa generasi emas Indonesia",,,1
Kang Ujang,@kangujangs,2024-01-18T17:52:12.000Z,"Mantap, berjuanglah wahai anak muda ",,,
𝐙𝐞𝐙𝐢𝐝,@ze_zid,2024-01-19T04:35:49.000Z,Congrats bang tetap konsisten mengamalkan mengawal ruh konstitusi,,,
Shinta Effendi,@shintaeffendi,2024-01-18T16:56:08.000Z,"Semoga mengusung semangat perubahan; bisa mengikis bahkan menghilangkan stigma buruk BEM bagi sebagian orang: 
BEM pasca reformasi bisa 'digerakkan/dibungkam' demi kepentingan tertentu. ",,,
Hasrul Dialamsyah,@HDialamsyah,2024-01-19T00:40:07.000Z,Maaf tanya kok kampus bandung gak mau ikutan ya?,,,
Grassroot,@yellowgrassroot,2024-01-19T06:06:34.000Z,"Semangat, selamat berjuang!",,,
kemntank bakar,@potatoechiepps,2024-01-19T12:16:15.000Z,buset mas gielbran masih enjoy kah setelah dicaci maki satu Indonesia,,,
Pertama El Wahid,@ElPertama,2024-01-18T15:00:00.000Z,"Bagus anak muda, semoga gen Z semakin melek dengan kondisi bangsa ini",,,
tumini dahlan,@winidahlan,2024-01-19T04:57:51.000Z,Doa sy untuk kalian adek adek tercinta....,,,
Pake.otak,@Pakeotakyuk,2024-01-18T14:56:49.000Z,"Rawat Demokrasi, tenggelamkan Dinasti. 
Panjang umur perjuangan",,,
Lucke Achmad,@seven7_7up,2024-01-18T18:15:41.000Z,"BEM kampus lain gak diajak kah ? Ajak gabung BEM lain utk merawat demokrasi dan tolak politik dinasti.
Ayo Gasss.....
Kapan turun kejalan lagi nih ??",,,1
Untuk Indonesia Sejahtera,@meditegal,2024-01-19T01:48:56.000Z,Semoga BEM didaerah menyusul buat juga aplikasinya biar rakyat bisa menggunakanya,,,
Sahat Tarigan,@SahatTarigan63,2024-01-19T02:03:23.000Z,Anak anak muda tetap semangat terus suarakan kemerdekaan dan demokrasi yg sehat.,,,
Mister Bayam,@Mister_Bayam,2024-01-18T23:47:54.000Z,"Mas, tolong kerahkan team dari para mahasiswa dengan latar belakang akademik yang sesuai dan terkait untuk garap survei secara kredibel.  Hasil survei itu sebagai pembanding atas hasil dari tukang survei bayaran. Agar opini publik terbentuk atas dasar akal & kewarasan berfikir.",,,5
Ngaji - Suporteran - Mangan,@ikiulil,2024-01-18T17:19:35.000Z,"Saya tidak pintar politik hukum, tapi saya mengerti proses yg buruk telat terjadi. Maka dari itu saya melawan ",,,
farida anwari,@faridamph,2024-01-18T23:04:47.000Z,"Makasih bung, bergeraklah kalian sbg agent perubahan dlm kesadaran berpolitik. Buat kami yg tak didengar suaranya. Berjanjilah utk independen, tak terpengaruh duit dn kedudukan yg mereka tawarkan.",,,1
Anak Haram Konstitusi,@kandasiapa,2024-01-19T01:07:42.000Z,"Semangat perjuangan buat teman-teman mahasiswa, ingat kita punya peristiwa 98 untuk guideline perubahan dari politik dinasti",,,
Manusia Kiyowo,@olysh___,2024-01-18T17:04:23.000Z,Semangat adik2 ,,,
FaridIdup,@farididoev,2024-01-18T23:58:46.000Z,"Apa aksinya bung, ayo tetapkan langkah untuk demokrasi yg sehat, hadang kecurangan.",,,2
OrangKayaAamiin,@orangkayaalways,2024-01-18T16:05:45.000Z,Yang dulu menonaktifkan pasti mikirnya akan membuat diam..ngga ada movement apapun..tapi mereka salah..lihatlah tanpa jabatan pun masih terus berjuang..semangaaat,,,2
Carolina Natadipradj,@sarpakana,2024-01-19T14:13:42.000Z,"Semangat ya Melki, Gielbran dkk pejuang muda demokrasi, saya mendoakan keselamatan kalian , Tuhan tidak tidur",,,
MantanMontir,@Mantanmontir22,2024-01-19T12:24:01.000Z,Mendukung adik2 mahasiswa.... Saatnya kalian bergerak... Kami sudah Muak pada 2 Periode ini...,,,
Yuli,@YuliCaem88,2024-01-19T02:53:31.000Z,"Bikin jaringan pemantau pemilu , mahasiswa ikut ngawasin TPS..kyk dulu saat pemilu 99, bnyk jaringan mahasiswa yg ikut jd pengawas jalannya pemilu multi partai pertama",,,
Jokitugas,@FarilStudents,2024-01-18T17:39:53.000Z,"gua harap gerakannya gak cuma menyadarkan anak muda aja, tapi pejabat dan penegak hukum yang isinya generasi lama bisa teredukasi juga. jadi pendekatannya jangan yang terlalu provokatif karena rawan dibungkam",,,
sdysdy,@sudaywow,2024-01-19T01:44:56.000Z,Bersyukur ada mahasiswa yg sudah terbangun dari tidur panjangnya. Semangat terus dan  jangan cepat menyerah ya. Semoga ini bisa segera menginspirasi rekan2nya yg masih lelap agar cepat siuman karena situasi dan kondisi bangsa sedang sangat buruk.,,,2
unseen2024_,@unseen2024,2024-01-18T16:31:28.000Z,"Ini baru Gen Z 
@nioniooo",,,1
Primuh,@Priyo__Muhammad,2024-01-19T04:49:39.000Z,"Keren bung 
@namasayamelki
  Ciptakan masa depan dgn jadi bagian dari sejarah bangsa",,,
Horizon Cctv,@CctvHorizo34195,2024-01-18T15:02:34.000Z,"Untuk adek2 pinter yg berintegritas,jatah kalian lah yg akan meneruskan estafet kepemimpinan bgs ini .jgn di isi pemimpin yg tak ada prestasi ,yg aji mumpung menguasai negri ini.tunjukkan kalian memang intelektual pewaris kemajuan bangsa. Negri ini bukan kerajaan",,,21
inca,@jibransauqi,2024-01-18T16:30:57.000Z,"Reformasi jilid II
Menjaga kewarasan yang semakin memudar, harapannya kalian dapat mengawal pemilu 2024 berjalan dengan JURDIL, tegaklah dengan idealisme pemuda/ pemudi Indonesia 1928.",,,1
dino baik,@tehpagiku,2024-01-19T02:28:43.000Z,"Saya suka semangat serta ideologi anak2 muda seperti kalian, kami dan kita semua",,,
Widya Putra,@widyaputras,2024-01-19T01:59:35.000Z,"@semafhatma
 ayo adik adikk, kemana kalian?",,,
Danan,@danan_wahyudi,2024-01-18T14:16:20.000Z,"Hidup mahasiswa....., gaskeun",,,
charrlotte,@lilcambridge123,2024-01-18T19:27:06.000Z,"Setiap orang ada masanya, setiap masa ada orangnya, panjang umur perjuangan",,,
TUKANG KOMPOR,@keG752,2024-01-18T15:32:52.000Z,Semangat!!! ,,,
Arie,@Arie_ariyan,2024-01-18T15:45:53.000Z,"Panjang Umur Perjuangan kawan..., hancurkan politik dinasti, jaga demokrasi supaya hukum tidak dikebiri...tetap jaga kondisi... do'a terbaik untuk kalian dan bangsa ini..",,,
,@karinaawu,2024-01-18T15:41:26.000Z,Semangatt adik adik mahasiswa. Kawal pemilu kali ini agar benar2 terhindar dari kecurangan apalagi perihal penghitungan suara.,,,
Mr Happy Sidauruk,@MrHappySidauruk,2024-01-19T01:39:41.000Z,SEMOGA PANGGUNGNYA DILIRIK.......,,,
ale,@kusnangdi,2024-01-19T00:08:05.000Z,Semangat Abang Abang pejuang,,,
Lupa password,@MTeroos,2024-01-18T15:33:42.000Z,Terimakasih orang-orang baik,,,
Joe Sampoerna,@josampoerna,2024-01-18T14:26:09.000Z,Gas pol bung,,,1
Shift F7,@Blasttotheair,2024-01-19T08:20:13.000Z,Selamat Berjuang!,,,
Keken,@kkeekkeenn,2024-01-18T17:36:24.000Z,Semangat terus ya ges gesku..,,,
Ivan Budiman,@ivanbodyman,2024-01-18T22:54:47.000Z,"Alhamdulillah sdh semangat lg nih para mahasiswa.
Hal yg penting/urgen dilakukan adlh KAWAL PEMILU.
Stlh pemilu 14/2, agenda nya mengadili rezim yg skrg (bhs yg viral skrg pemakzulan). Apalg kl smp bikin kebijakan² baru yg menyesatkan, spt pajak motor bensin mo dinaikkan.",,,6
Ariyo Arinsa Putra,@ariyoap,2024-01-19T00:42:13.000Z,Congrats buat Forum Anomali yang telah dibentuk. Semoga bisa konsisten dan berjuang mewujudkan apa yang menjadi cita-cita luhur kita bersama.,,,
yaddoogyah19,@yaddoogyah19,2024-01-18T22:12:01.000Z,Semoga memberi impact besar utk demokrasi indonesia bung,,,
THE GAME A,@THEGAMEA0806,2024-01-18T16:34:09.000Z,"ayo gerakin mahasiswa utk kawal tps, ditunggu",,,
Ahmad,@AhmadSahidah,2024-01-18T14:34:53.000Z,Sokong. Bergerak. Bertindak.,,,
MANAHADAP,@kulidalan,2024-01-18T14:55:02.000Z,Panjang umur perjuangan,,,8
oJoL Single fighter,@Ojolsang3,2024-01-18T16:12:26.000Z,"Terus semangat anak muda !

Terus berjuang untuk Indonesia yang lebih baik.",,,
Jaka Samudera,@Jakasamudera123,2024-01-18T16:28:43.000Z,Dukung. Semangat Bung !,,,
Fandi Wicaksono,@FandiWicaksono2,2024-01-19T02:34:37.000Z,Aden sama isa ga diajak,,,
maghfur el muhammady,@el_mouh,2024-01-18T14:41:52.000Z,Lawan dan Menang! Abadi Perjuangan!,,,
troy oeija,@adjie_eija,2024-01-18T14:44:15.000Z,"Berjuang terus mas utk bangsa & utk demokrasi kt ,Inshaa Allah kebenaran akan menemukan jalan y sendiri...sehat2 semua ketua Bem",,,1
Frankkky,@neverlethergoo,2024-01-18T23:31:36.000Z,"tolong ajak kabem Unair sama kabem ITS masbroo, jawa area timur rasanya kurang terdengar taringnya",,,
Akun Cadangan,@AbabilSemprong,2024-01-19T00:32:51.000Z,Berapa banyak mahasiswa yg ikut nyoblos ??,,,
rafiii,@noidentiall,2024-01-19T05:27:23.000Z,Akwkwk ada caleg didepan,,,
berjuangkawan,@maybeonedaydap,2024-01-18T17:50:26.000Z,bem undip kagak ngapa ngapain apahh,,,
Baekkie Chan,@BaekkieChan461,2024-01-18T15:03:34.000Z,semangattt bunggg,,,
Mansur Zuhri Tuhepaly,@MansurZuhri,2024-01-19T04:32:10.000Z,"Mantap saudara ku, sukses selalu",,,1
Okta Erwadi,@OErwadi,2024-01-18T23:53:59.000Z,Lanjutkan bang penerus amin rais sudah langka sekarang,,,
holy man,@alboy_aboe,2024-01-19T01:39:44.000Z,Saat nya yg Muda yg bergerak,,,
coffee break,@bongmyukidy,2024-01-18T15:04:48.000Z,semangat dik ,,,
Dinda Wahyuni,@whyndinda,2024-01-18T17:14:34.000Z,"Bang, hati-hati ya. Jangan lupa berkabar di media sosial.",,,
FPL~Dynamic~Indonesia,@DynamicFPL,2024-01-18T18:14:36.000Z,Saya yakin pada akhirnya mahasiswa akan tolak 02. Jangan pilih si giant dan suneo #IndonesiaRaya,,,
Saepul,@Saepul_ameera,2024-01-19T01:05:55.000Z,Kalau bukan mahasiswa siapa lagi yang bisa gerak.. semangat !!,,,
Wilmark Manik,@WilmarkManik,2024-01-19T00:46:52.000Z,Kawal KPU!,,,
Hans V,@Farhan_ardianR,2024-01-18T18:17:44.000Z,asik nih mulai menggeliat...,,,
Francoes Mitter,@FransMitter,2024-01-19T03:48:50.000Z,Akankah kalian menjadi pemilih rasional di kemudian hari?,,,
airudiwich,@airudiwich,2024-01-19T02:21:44.000Z,Terus berjuang anak muda. Jangan takut melawan kesewenang-wenangan. Hajar terus!,,,
Nama tidak boleh kosong,@isilitid,2024-01-18T17:13:25.000Z,Join dong sebagai mata2.,,,
Fahmi Nur Muzaqi,@Fnmuzaqi,2024-01-18T22:28:22.000Z,"Semangat. Saya nonton aja.
Hehe",,,
Koboy Kampus,@PKeriput,2024-01-18T18:31:26.000Z,"Anomali adalah kunci, hiduplah wahai koboy kampus, perjuangan nafasmu tetap brisik sehingga didengar kaum Bourjois tuli pendengaran",,,
bumbumicinxx,@Faiqrahman_,2024-01-18T15:09:28.000Z,Jos mas pres,,,
Chelsea Indonesia Fan,@CHELFANIDN,2024-01-18T16:59:54.000Z,mau nyumbang lewat apa bro,,,
saldesa indonesia,@Saldesa_INA,2024-01-19T11:36:17.000Z,Aksi nyatanya apa mas?,,,
NotConspiracy,@RifkyLutfy,2024-01-18T15:47:42.000Z,Sok mlah Gas keun. walopun udah injurytime,,,
Telka,@vit_sapipa,2024-01-19T02:21:15.000Z,Kasus kekerasan seksualnya udah selesai kah?,,,
Tragedi kardus digembok..!,@HarryAlminangki,2024-01-19T00:47:50.000Z,"ingat apa yg diperjuangkan dg air mata, darah dan nyawa  tahun 98,tetap sama ddg hari ini, yg berbeda hanya orang2 nya, estafet yg kalian terima jalankan dg kecerdasan yg kalian punya, tak perlu sama dg generasi sebelumnya tapi nilai perjuangan nya harus senyawa dan berlanjut.",,,
Kucing Tua,@kucingtuabanget,2024-01-18T16:10:13.000Z,"Mana nih KM ITB euy, mgk beda haluan kali ya",,,
𒆜tomy𒆜 NKRI 100%,@tomy46774,2024-01-19T07:15:01.000Z,"Melki harusnya kembali aktif sebagai BEM, karena kasus nya tidak ada bukti-bukti jelas, ini harus ada perlawanan juga",,,
revaa,@rpuyyu,2024-01-18T14:19:12.000Z,smngt kak ur not alone,,,1
Puja Kelam,@CecepLagi,2024-01-18T15:16:39.000Z,Rawatlah demokasi di Indonesia ini wahai Anak Muda.,,,1
Sobirin Durahman,@Mr_Sobirin,2024-01-18T17:00:21.000Z,Yang kita perjuangkan adalah Kemakmuran Rakyat bukan demokrasi atau oligarki/dinasti.Tengok sejarah.Apakah hanya dgn Demokrasi Kemakmuran dapat dicapai atau apakah hanya dgn oligarki/dinasti kemakmuran dapat dicapai.Kemakmuran dapat dicapai atas Berkat Rahmat Tuhan Yang Maha Esa,,,1
Uniggasweededan,@oatmealsgood,2024-01-18T19:07:18.000Z,Akhirnya memang harus mahasiswa lagi yg jadi peluru terakhir. Banyak harapan dan doa beriringan dengan langkah kalian. Mari kita kawal sama-sama.,,,5
Acep Selowww,@AcepSelow,2024-01-18T14:50:25.000Z,"Selamat berjuang, jangan lelah menyuarakan kebenaran dan mencerdaskan kehidupan bangsa",,,3
🆄🅽🅸🅵🆁🅼,@WAHYU_UNIFORM,2024-01-19T09:35:39.000Z,"Dl digebukin dg rotan dlm aksi menolak SDSB... 6 th berlalu, bekas  gebukan rotan di punggung baru ilang

Alhamdulillah, saat itu pemerintah merespon, & akhirnya menghapus SDSB

Keberhasilan itu tidak lepas dari kekompakan mahasiswa di seluruh daerah

Mahasiswa skrg kurang kompak",,,4
Nathaya,@CakIchwan5,2024-01-18T22:30:26.000Z,Kalian ga akan bisa utk menjatuhkan dan memakjulkan presiden coba kalian pikir presiden di dukung rakyat banyak 85 persen ingat orang baik tidak bisa di lawan kalau memaksakan kehendak kalian akan dilawan dengan 85 persen rakyat Indonesia ingat itu,,,3
pathoel_soesantoe,@pathoel_soesant,2024-01-18T15:27:32.000Z,"ayo adik2 mahasiswa, timingnya pas, lawan demokrasi dinasti yg di gaungkan rejim, berjuang untuk rakyat itu menggairahkan, jadi kenangan saat kalian berajak tua dan idealisme itu mulai hilang. panjang umur perjuangan!!!",1,,2
Reyhans,@reyhansagevti_,2024-01-19T10:43:02.000Z,mungkin psikologinya ada yang masih terguncang sejak peristiwa 1998,2,,45
Yanti,@DS_yantie,2024-01-19T07:20:12.000Z,Padahal publik juga udah tau mana Capres yg kurang sehat ,2,5,54
QUEEN,@Arnda10_,2024-01-19T13:43:44.000Z,Tidak semua hal di ungkapin ke publik. Yang penting selama ini rakyat juga udah tau dan bisa menilai sendiri.,,,1
,@excallingg,2024-01-19T09:49:07.000Z,,1,,
ki𝕩ana𝕩,@ndrypd,2024-01-19T10:12:34.000Z,,1,,
Singkong Stunting (Non-Ferrous Metal),@rthurbraga,2024-01-19T03:03:25.000Z,Apakah hasil psikotes capres jompo penculik kejiwaannya dipertanyakan ?,10,15,336
fajar,@f_jart,2024-01-19T03:01:09.000Z,"Publik itu Warga Negara yang bayar pajak, ikut membiayai Negara.
Kami berhak atas transparansi apapun dari penyelenggara Negara, termasuk event Pemilu yang dijalankan KPU.
Jadi kalau gak ada transparansi, rakyat tidak berhak untuk tau, sebaiknya Negara ini bubar saja.",8,33,536
