UserName,Handle,Timestamp,Text,Comments,Likes,Retweets
Diladew,@diladeww,2024-01-18T11:37:53.000Z,ayo pak jangan kasih kendor untuk para caleg yang melakukan transaksi mencurigakan #PPATKdukungPemiluBersih,,,
Auris.,@alunaauristela3,2024-01-18T13:20:06.000Z,"Baru tau info ini, ayo gass pak harus bener-bener di usut! 
#PPATdukungPemiluBersih",,,
caturnia1703,@caturnia1703,2024-01-18T11:51:19.000Z,"waww emang harus diusut tuntas nih biar pemilu 2024 bersih dan luber jurdil karna gaada kecurangan lagi.
#PPATKdukungPemiluBersih",,,
Risfa Caniago,@risfa_caniago,2024-01-18T11:38:28.000Z,"Satukan suara kita untuk mewujudkan pemilu bersih dan adil, di mana setiap suara dihargai dan demokrasi kita diperkuat. Wujudkan masa depan yang lebih baik melalui partisipasi dan keputusan yang transparan. #PPATKdukungPemiluBersih",,,
Margö,@kidossuck,2024-01-18T11:51:42.000Z,wah parah banget seharusnya tidak boleh seperti ini #PPATKdukungPemiluBersih,,,
dilanmarmu,@dilanmarmu,2024-01-18T11:40:15.000Z,masyarakat harus bersama #PPATKdukungPemiluBersih agar tidak ada kecurangan,,,
Tanya Chen,@TanyaCh00774934,2024-01-18T12:54:15.000Z,"aduhh untuk ppatk telah menyelidiki setiap transaksi mencurigakan yang dilakukan oleh para caleg
#PPATKdukungPemiluBersih",,,
,@Parkjiy70204374,2024-01-18T11:38:57.000Z,"harus diusut tuntas sih ini, biar kedepannya kinerja para calon pemimpin, caleg, parpol dll bisa berfokus ke tugasnya masing-masing
#PPATKdukungPemiluBersih",,,
ra,@mikopicu,2024-01-18T11:33:23.000Z,mantap ppatk semoga pemilu 2024 ini menjadi pemilu yang adil dan bersih yaa #PPATKdukungPemiluBersih,,,
Heather,@Heather33056361,2024-01-18T12:52:40.000Z,"bagusss nih kalau ppatk juga mendukung pemilu bersih, jadi tidak ada yang curang 
#PPATKdukungPemiluBersih",,,
Dean Evanof,@DeanEvanof92454,2024-01-18T13:02:51.000Z,"ayo bersama ppatk berantas kecurangan dalam pemilu 2024 ini gaisss
#PPATKdukungPemiluBersih",,,
aster +=♡,@haechieh,2024-01-18T11:45:22.000Z,"Waduh baru tau terimakasih ppatk semoga dengan ini pemilu 2024 bersih dan tidak ada transaksi2 seperti ini   #PPATKdukungPemiluBersih
http://kompas.id/baca/polhuk/20…",,,
lak,@macadepandmu,2024-01-18T11:38:28.000Z,dukung terus pemilu bersih agar terlaksana dengan baik #PPATKdukungPemiluBersih,,,
pubu,@coupsoftears,2024-01-18T11:43:30.000Z,Waduh bahaya juga nih. semoga dengan adanya PPATK dapat meminimalisir adanya praktek transaksi mencurigakan agar bisa mewujudkan pemilu yang bersih #PPATKdukungPemiluBersih,,,
sopiepie,@sofies0605,2024-01-18T11:35:56.000Z,"sip deh pak, bersihkan & tuntaskan sampe ke akarnya #PPATdukungPemiluBersih",,,
٩(ˊⰙˋ⠕)و,@pairujeuuu,2024-01-18T13:10:54.000Z,"harus diselidiki sih ini, mencurigakan sekali #PPATKdukungPemiluBersih",,,
𝐋 𝐈 𝐀,@akasiaparadoxa,2024-01-18T11:34:09.000Z,Kerja bagus PPATK  Lanjutkan terus kinerjanya supaya semakin mewujudkan pemilu yang adil dan bersih  #PPATKdukungPemiluBersih,,,
hei,@Aliyaa928108,2024-01-18T11:32:15.000Z,Harus tetap selalu mendukung pemilu yang bersih dan aman #PPATKdukungPemiluBersih,,,
sora,@aixoura,2024-01-18T11:41:29.000Z,"wihh ngeri banget liat angkanya, kawal terus kalo ada yg mencurigakan kaya gini, jgn sampe ada kecurangan"" di pemilu kali ini, yang bersih bersih ajaa #PPATKdukungPemiluBersih",,,
Ririnni0210,@febria98936,2024-01-18T11:32:02.000Z,"Harus diusut tuntas! agar kedepannya kinerja para calon pemimpin, caleg, parpol dll bisa berfokus ke tugasnya masing2. Yakni melayani masyarakat dn mensejahterakan rakyat indonesia
#PPATKdukungPemiluBersih",,1.0,
lol,@playinwthme,2024-01-18T11:33:46.000Z,"ya ampun bener bener harus dihindari yang beginian tuh, semangat terus pak kepala ppatk ivan yustiavandana dalam mengungkap transaksi mencurigakan pemilu 2024  #PPATKdukungPemiluBersih",,,
yeoboraa,@yeoboraa,2024-01-18T13:34:34.000Z,"yuk dukung pemilu bersih dan dukung ppat usut tuntas transaksi mencurigakan jelang pemilu
#PPATKdukungPemiluBersih",,,
Luv,@w1shmelvck,2024-01-18T11:45:06.000Z,"Usut tuntas hingga wujudkan pemilu 2024 luberjudil 
#PPATKdukungPemiluBersih",,,
seoyaa,@youngse0o,2024-01-18T13:35:36.000Z,"Harus di usut tuntas sih ini, untuk meminimalisir kecurangan menjelang pemilu
#PPATKdukungPemiluBersih",,,
shi,@riax_ria,2024-01-18T11:49:52.000Z,Wah yuk di usut #PPATKdukungPemiluBersih,,,
Renata,@Rnataa10,2024-01-18T11:32:49.000Z,"pakcara kerjanya beneran yah, karna ngungkap sejumlah temuan yg mengejutkan menjelang pemilu 2024 itu termasuk hal yang cukup ekstrim . Kita ngga tau ada apa aja di balik politik. Semangat bapakk #PPATKdukungPemiluBersih",,,
123,@windflower622,2024-01-18T11:47:05.000Z,"memang kalau mau pemilu ada ajaaa yang terjadi, semoga tahun ini pemilu bersih dan adil #PPATKdukungPemiluBersih",,,
sududi,@xsehunyluv,2024-01-18T11:34:30.000Z,mari kita dukung pemilu terlaksana dengan bersih #PPATKdukungPemiluBersih,,,
jinme,@jinme0412,2024-01-18T11:43:40.000Z,"wah parah banget nih, semoga pemilu tetap bersih dan terhindar dari kecurangan #PPATKdukungPemiluBersih",,,
nubb,@nubbystumps,2024-01-18T11:37:32.000Z,"bisa yuk dibersihin temuan temuan transaksi caleg yang mencurigakan ini demi pemilu yang bersih
#PPATKdukungPemiluBersih",,,
na~,@Jis0ngie,2024-01-18T12:02:26.000Z,"bahaya juga ya kalo ada hal yang mencurigakan, semoga pemilu tahun ini dilancarkan deh #PPATKdukungPemiluBersih",,,
strawberry cake,@berriesbbllue,2024-01-18T11:33:11.000Z,keren ppatk semoga pemilu skrg bersih dah #PPATKdukungPemiluBersih,,,
J,@sweetlikerosess,2024-01-18T11:45:11.000Z,keren banget pak ivan yustiavandana bisa mengungkap hal yg mencurigakan #PPATKdukungPemiluBersih,,,1.0
best town,@besttown5,2024-01-18T11:40:35.000Z,"masih ada aja yg mau berbuat curang, please semoga pemilu ini berjalan dengan transparan #PPATKdukungPemiluBersih",,,
apex,@alphaf3male__,2024-01-18T11:50:01.000Z,harapan pemilu tahun ini ga ada hal mencurigakan #PPATKdukungPemiluBersih,,,
migi,@dignimssi,2024-01-18T11:51:18.000Z,"loh beneran ta? bahaya bgt ini lho
#PPATKdukungPemiluBersih",,,
chr:3,@violeteis,2024-01-18T11:35:34.000Z,pokoknya dukung terus pemilu yg bersih dan semangat terus ppatk untuk mengungkap hal hal yg tdk mengenakan menjelang pemilu ini #PPATKdukungPemiluBersih,,,
pat,@fvqbt2,2024-01-18T11:33:31.000Z,"semuanya harus ditindaklanjuti sih ini ga bisa dibiarin gitu aja
#PPATKdukungPemiluBersih",,,
Ayesha,@Oxpicknavaari,2024-01-18T13:03:08.000Z,"Berantas semua hingga ke akar2nya.. Semoga dengan adanya temuan PPATK ini semua menjadi sadar sehingga ke depannya indonesia makin bersih darisegala kecurangan pemilu..
#PPATKdukungPemiluBersih",,,
,@cnnfer,2024-01-18T12:54:47.000Z,"niceee ppatk terus dukung pemilu bersih tahun ini!! 
#PPATKdukungPemiluBersih",,,
shanin,@shanindyya_,2024-01-18T11:36:41.000Z,ayo terus selidiki sampai tuntas #PPATKdukungPemiluBersih,,,
Allen,@glssyblssm,2024-01-18T11:39:58.000Z,semoga pemilu tahun ini bersih dari kecurangan #PPATKdukungPemiluBersih,,,1.0
Gina,@GinaBel48521008,2024-01-18T12:53:34.000Z,"memang sudah sepatutnya di selidiki sih untuk para caleg yang curang dan mencurigakan
#PPATKdukungPemiluBersih",,,
Ratih Kusumaningrum,@RatihKusum51059,2024-01-18T11:42:52.000Z,"berantas segala praktek kecurangan dalam pemilu agar terwujud pemilu yg jujur dan adil
#PPATKdukungPemiluBersih",,,
nohhyuck,@chanhaeeluv,2024-01-18T11:38:05.000Z,Semoha  PPATK ini semakin bersih dan tanggap #PPATKdukungpemilubersih,,,
—,@uniqcornxx,2024-01-18T12:20:47.000Z,"waduh diluar nalar ternyata, salut sih sama pa ivan yustiavandana! semoga bisa diusut tuntas ya pak #PPATKdukungPemiluBersih",,,
bebek | aktif sesuai kebutuhan,@nanalourfff,2024-01-18T12:01:28.000Z,"hadeh bisa-bisanya ada temuan ginian, kudu diusut sampe ke akarnya ini  #PPATKdukungPemiluBersih",,,
kykykvr,@kykykvr,2024-01-18T11:46:08.000Z,semoga kasus-kasus ini bisa didalami lebih lanjut #PPATKdukungPemiluBersih,,,
Jusjambu,@Njusjambu,2024-01-18T11:34:04.000Z,waduh banyak banget ternyata. ngeri yah untung ppatk cepat tanggap. semoga pemilu bisa berjalan secara bersih dan jujur #PPATKdukungPemiluBersih,,,
Triaaawulan,@triaaawul,2024-01-18T11:33:48.000Z,"dukung terus pokoknuaa pemilu yg bersih , semangat terus ppatk untuk mengungkap hal hal yg tidak mengenakan menjelang pemilu ini #PPATKdukungPemiluBersih",,,
prettygirll,@prettygirrlls,2024-01-18T11:42:20.000Z,"yaa ampunn, yukk kita dukung pemilu bersih 
#PPATKdukungPemiluBersih",,,
freetag forever,@freetagpicknava,2024-01-18T13:38:52.000Z,"Miris liatnya para caleg 2024 melakukan transaksi mencurigakan, keren pak ivan yustiavandana #PPATKdukungPemiluBersih",,,
kij,@kijbumm,2024-01-18T11:44:16.000Z,"aduh harus diusut tuntas sih ini, supaya caleg caleg yang nanti kepilih benar-benar bersih #PPATKdukungPemiluBersih",,,
,@fmrget,2024-01-18T12:51:16.000Z,"sangat di sayangkan jika para caleg melakukan hal yang mencurigakan, akan ada banyak masyarakat yang di rugikan
#PPATKdukungPemiluBersih",,,
siapa,@siapaorkay,2024-01-18T11:44:49.000Z,ngerii bgtt woey bacanyaa #PPATKdukungPemiluBersih kayaa semuanya terbongkar gitu loh ya ga si,,,
.rar,@rarenesia,2024-01-18T11:48:12.000Z,"semoga ini jadi pertanda kalau pemilu tahun ini bersih, lancar, dan sukses #PPATKdukungPemiluBersih",,,
Ika,@pecintasawo,2024-01-18T11:34:22.000Z,"semoga kinerja ppatk tetap mendukung pemilu yang bersih, semangat terus
#PPATKdukungPemiluBersih",,,
Mahen Putra,@MahenPutra2,2024-01-18T11:47:42.000Z,"waduhh, semogaa indonesia diberi pemimpin yg amanah dan tdk ada sedikitpun kecurangan",,,
,@syifarmaci,2024-01-18T11:30:18.000Z,"waduh, ayo wujudkan pemilu yg luber jurdil  #PPATKdukungPemiluBersih",,,
mas jew,@qiuint,2024-01-18T12:57:04.000Z,"sangat di sayangkan jika para caleg melakukan hal yang mencurigakan, akan ada banyak masyarakat yang di rugikan
#PPATKdukungPemiluBersih",,,
bee,@funnyIicious,2024-01-18T11:37:40.000Z,"Wahh temuan yang mengejutkan jelang pemilu nih, ngerii. Jika terbukti melanggar aturan semoga segera diproses #PPATKdukungPemiluBersih",,,
Berrypie,@FernindaA57086,2024-01-18T11:39:07.000Z,"Wahh, semangatt pak untuk mengungkap semuaaa!
#PPATKdukungPemiluBersih",,,
Sukma Bhayangsari,@SukmaQAH,2024-01-18T11:35:57.000Z,"jangan salah pilih dalam pemilu ,pemimpin yang bersih menciptakan masyarakat sejahtera #PPATKdukungPemiluBersih
http://kompas.id/baca/polhuk/20…",,,
Widhia,@Widhia22949429,2024-01-18T11:43:14.000Z,"Waduh bener bener harus di hindari yang begini begini, dukung bgt #PPATdukungPemiluBersih dengan pemilu yang bersih semoga menjadi langkah baik buat politik Indonesia",,,
Gigixx,@Gillskyy_,2024-01-18T11:44:00.000Z,ayo dukung parpol bersih dari korupsi #PPATKdukungPemiluBersih,,,
frey hreee,@BriaWinfrey12,2024-01-18T12:51:18.000Z,"waduh sangat tidak pantas jika seorang caleg melakukan hal curang seperti ini, terimakasih untuk ppatk yang terus mendukung pemilu bersih 
#PPATKdukungPemiluBersih",,,
yayays,@yayaysyana,2024-01-18T11:51:08.000Z,agar tercipta suasana pemilu yg kondusif mari kita dukung #PPATKdukungPemiluBersih,,,
Cipeyy,@Cipeyy769236,2024-01-18T14:34:34.000Z,"ayo ppatk pasti bisa menangkap caleg yang melakukan kecurangan agar tidak ada masyarakat yang di rugikan
#PPATKdukungPemiluBersih",,,
Dendi,@Yllw123,2024-01-18T11:32:31.000Z,"Lanjutkan pak biar kita masyarakat bisa benar2 menilai para caleg... 

#PPATKdukungPemiluBersih",,,
Alin,@vagarytan_,2024-01-18T11:32:56.000Z,Kerenn bangett #PPATKdukungPemiluBersih gas keunn wujudkan pemilu luber jurdil ,,,
,@fleurcassee_,2024-01-18T12:11:25.000Z,"serem juga ya, semoga nanti yang terpilih pemimpin yang amanah #PPATKdukungPemiluBersih",,,
flylilies,@flylilixx,2024-01-18T11:37:41.000Z,"waduhhh ada ada ajaa yaa, aku dukung bangett ni yang kaya gini semangat teruss untuk  ppatk demi mewujudkan pemilu yang bersih #PPATKdukungPemiluBersih",,,
Corey taylor666,@Corey111taylor,2024-01-18T11:36:04.000Z,"Kawal terus transaksi transaksi yang mencurigakan, demi pemilu yang jujur dan bersih #PPATKdukungPemiluBersih",,,
Sunset,@Opacarophiledel,2024-01-18T11:40:06.000Z,"untungnya ppatk sigap dalam melakukan tugasnya, terima kasih ppatk atas kerja kerasnya dalam mewujudkan pemilu bersih #PPATKdukungPemiluBersih",,,
'Ale,@letta_samoyed,2024-01-18T11:31:49.000Z,ayo patuhi 5 asas dalam menjalankan pemilu yaitu luberjudil #PPATKdukungPemiluBersih,,,
Lion,@babyL_3,2024-01-18T13:30:23.000Z,Dukung #PPATKdukungPemiluBersih untuk pemilu yg berish dan disiplin semua demi kebaikan negara,,,1.0
zazatepungbumbu,@yalyya_,2024-01-18T11:36:10.000Z,Dukung banget #PPATKdukungPemiluBersih dengan pemilu yang bersih semoga menjadi langkah yang baik untuk politik Indonesia. Bagus semangat bapak,,,1.0
miiyuu,@SUMIYANTI270173,2024-01-18T11:34:44.000Z,"Semangat selalu untuk ppatk semiga tercita pemilu yang sukses
#PPATdukungPemiluBersih",,,
A.,@bbykoal4,2024-01-18T12:48:38.000Z,wahh pemilu harus luber jurdil dong semoga gaada lagi transaksi mencurigakan deh #PPATKdukungPemiluBersih,,,
prisha,@jennoety,2024-01-18T11:36:45.000Z,"waduuuuhhh, ngerii amaat yaa jelang pemilu ginii, ayo wujudkan pemilu yang luber jurdil  #PPATKdukungPemiluBersih",,,
kimarayoo,@kimarayoo,2024-01-18T11:39:13.000Z,"waduh banyak temuan transaksi yang mencurigakan dilakukan oleh para caleg, kita harus menghindari hal hal seperti ini dan mewujudkan pemilu yang bersih dan bebas dari segala kecurangan #PPATKdukungPemiluBersih",,,
n,@heyyocatz,2024-01-18T11:34:38.000Z,semoga aja dengan pemimpin PPATK yang bersih ini makin tanggap dalam mensukseskan pemilu 2024 nanti #PPATKdukungPemiluBersih,,,
alwaysNT,@alwaysNT231021,2024-01-18T11:43:56.000Z,"gercep bgt pptk, teruslah melakukan bersih2 bagi para caleg menjelang pemilu 2024, agar terciptanya lingkungan pemilu yg bersih tanpa korupsi #PPATKdukungPemiluBersih",,,
Rennd,@Urf4vcl0wn_,2024-01-18T11:40:52.000Z,"waduh banyak banget tuh nominalnya, bisa diusut dan diberesin sih biar pemilu kali ini benar-benar bersih #PPATKdukungPemiluBersih",,,
chill,@selaginellales,2024-01-18T13:33:34.000Z,"Harus diusut tuntas sih ini agar pemilu bersih
#PPATKdukungPemiluBersih",,,
Kayara.,@Messiera82,2024-01-18T11:30:42.000Z,"lhoo, kok ngeri banget ya? kenapa banyak banget hal kayak gini ya? mana keungkapnya pas mau pemilu lagi. hadeuuhh #PPATKdukungPemiluBersih",,,
winnie,@rasainiye,2024-01-18T11:37:29.000Z,"waduh bahaya nih, harus segera diusut tuntas biar gaada lagi yang mencurigakan apalagi sampe merugikan pihak lain #PPATKdukungPemiluBersih",,,
Khusni Saputri12,@KSaputri12,2024-01-18T11:39:56.000Z,"Wow keren bgt pak,  semoga ppatk ini makin cepet dan bisa mewujudkan dan mensukseskan pemilu 2024 yang bersih #PPATKdukungPemiluBersih",,,
Miwmiww,@ayangjisso,2024-01-18T13:29:31.000Z,"mari kita wujudkan bersama pemilu yang bersih dan damai di februari 2024 nanti 
#PPATKdukungPemiluBersih",,,
mhmdraais,@mhmdraais,2024-01-18T11:35:33.000Z,pokoknya pemilu 2024 nanti harus bersih dan masyarakat sejahtera dukung trs #PPATKdukungPemiluBersih,,,
Gimari Ruri,@rurigimari,2024-01-18T11:34:06.000Z,hayolo mari ciptakan pemilu yang bersih dan damai untuk kebaikan dan kemajuan bangsa dan negara #PPATKdukungPemiluBersih,,,
Dandelions,@Dandeliionsz,2024-01-18T11:42:12.000Z,"Waduhh ko gini, semoga tetep terlaksana ya pemilu yang luber jurdil, biar masa depan bangsa jadi cerah
#PPATKdukungPemiluBersih",,,
pin's,@ailoufyu,2024-01-18T11:39:05.000Z,"waww emang harus diusut tuntas nih biar pemilu 2024 bersih dan luber jurdil karna gaada kecurangan lagi.
#PPATKdukungPemiluBersih",,,
valerie ༊*·˚,@_ffairytalee,2024-01-18T11:40:11.000Z,wahh semoga bisa diusut dengan baik yaa pak #PPATKDukungPemiluBersih,,,
ᵏᵒᵒ'ˢmichi,@nabatimangga,2024-01-18T11:33:35.000Z,"waduh ngeri nya demi sebuah jabatan untuk negara, ini harus segera di basmi sih meresahkan ayooo gas untuk #PPATKdukungPemiluBersih",,1.0,
winter,@peacpc,2024-01-18T12:46:30.000Z,Tuntun dan kawal terus untuk mengungkapkan kejanggalan² menjelang pemilu demi #PPATKdukungPemiluBersih,,,
naaa,@yrmyh_,2024-01-18T11:41:49.000Z,"ayo pak usut dan bersihkan sampai tuntas, jangan sampai hal seperti ini mengotori pemilu!!
 #PPATKdukungPemiluBersih",,,
Cherry,@cherryboomcher,2024-01-18T11:41:28.000Z,"ayo dong jadikan pemilu kali ini jujur dan bersih
#PPATKdukungPemiluBersih",,,
alcha,@jmndimples,2024-01-18T11:44:45.000Z,"keren banget #PPATKdukungPemiluBersih, semoga pemilu 2024 benar² bersih dan bebas dari segala bentuk kecurangan",,,
lunaslunaslunas,@2024debtfreeya,2024-01-18T11:54:21.000Z,"ngeri betulll. semoga tahun ini dan dipemilihan selanjutnya bisa lebih bersih, adil dan bersih dari kecurangan  #PPATKdukungPemiluBersih",,,
Nurul_iza,@nurulizatulm,2024-01-18T11:33:49.000Z,Perlu diselidiki lagii #PPATKdukungPemiluBersih tetap semangat menjalankan tugas,,,
forlynnn,@cerdial,2024-01-18T12:55:18.000Z,"harus di usut sampai tuntas si kasus ini, melibatkan para caleg yang akan di pilih oleh masyarakat
#PPATKdukungPemiluBersih",,,
Beth Knight,@BethKni29313170,2024-01-18T14:30:38.000Z,"aku pokoknya dukung ppatk agar pemilu 2024 bisa bersih 
#PPATKdukungPemiluBersih",,,
-,@jelajahiduniamu,2024-01-18T13:36:13.000Z,Dih jangan bikin malu deh negara demokrasi kayak indonesia ada yang curang saat pemilu nanti #PPATKdukungPemiluBersih,,,
puput,@pnkflaming0,2024-01-18T11:33:32.000Z,makin kesini makin keren aja #PPATKdukungPemiluBersih,,,
Suka Makan Mochi,@syf_buzz,2024-01-18T12:44:28.000Z,"parah nih harus segera di atasin, kita wujudkan pemilu bersih dan damai #PPATKdukungPemiluBersih",,,
izy,@izeazyy,2024-01-18T11:42:41.000Z,ini harus diusut tuntas! #PPATKdukungPemiluBersih,,,
fanalog__,@fanalog1,2024-01-18T16:07:57.000Z,"Harus dukung dong #PPATKdukungPemiluBersih, jangan sampai udah 'jadi' baru terbongkar semuanya",,,
fujamaharani67,@fujamaharani67,2024-01-18T13:24:02.000Z,Jadi pemimpin tuh memang harus yang bersih dan pastinya masyarakat sejahtera #PPATKdukungPemiluBersih,,,
nara the sheep,@siomayypedes,2024-01-18T11:50:24.000Z,"ayo harus diusut betul betul pak pemilu 2024 harus berjalan dengan bersih
#PPATKdukungPemiluBersih",,,
ꕤ,@winwinmyboyfie,2024-01-18T11:33:43.000Z,"ngeri amat yaa jelang pemilu gini banyak temuan-temuan yang mengejutkan, jangan sampe dehh banyak kecurangan mending kita wujudkan pemilu bersih, aman dan nyaman #PPATKdukungPemiluBersih",,,
kaonashi,@lystesz,2024-01-18T11:48:33.000Z,"bahaya banget buat masa depan bangsa, usut tuntas sampe bersih ya pa jangan sampe ada korupsi diantara kita #PPATKdukungPemiluBersih",,,
piw,@kriisstaa_,2024-01-18T12:38:31.000Z,"keren nih, semoga PPATK bisa semakin cepat tanggap #PPATKdukungPemiluBersih",,,
Esa,@kopisiapaya,2024-01-18T12:45:10.000Z,"astaga hal kaya gini memang bahaya banget. semangat terus PPATK 
#PPATKdukungPemiluBersih",,,
Bila App Premium,@bilaappscorner,2024-01-18T11:39:01.000Z,mantap pak.. semoga pemilu kali ini bisa berjalan secara jujur dan adil.. miris banget sih liatnya kenapa banyak transaksi mencurigakan #PPATKdukungPemiluBersih,,,
a (taylor’s version),@scogurI,2024-01-18T11:40:02.000Z,ini harus segera di selidiki sih biar pemilu tahun ini berjalan dengan baik #PPATKdukungPemiluBersih,,,
☆,@haithqam,2024-01-18T11:31:23.000Z,waduh semoga pemilu dapat terlaksana dengan jujur dan bersih #PPATKdukungPemiluBersih,,,
Oky Setiawan,@oky_setiadongs,2024-01-18T11:48:59.000Z,"wih keren, bagus dong ini biar pemilu kita bersih dan adil harus sgra di laporkan kalo ada kecurangan.
#PPATKdukungPemiluBersih",,,
vio,@foroliverr,2024-01-18T12:38:49.000Z,"wah bahaya nih, wajib diselidiki ini mah biar pemilu nanti berjalan damai dan lancar
#PPATKdukungPemiluBersih",,,1.0
dominic,@arti_puspasari,2024-01-18T11:35:07.000Z,"Makin mengejutkan aja nih menjelang pemilu 2024, #PPATKdukungPemiluBersih semangat pak agar pemilu ini bersih tidak ada kecurangan",,,1.0
elsyaarai,@ignmre,2024-01-18T14:33:06.000Z,"keren nih kinerja dari ppatk yang menyelidiki banyaknya caleg melakukan kecurangan
#PPATKdukungPemiluBersih",,,
maryam,@StMry88,2024-01-18T11:46:40.000Z,hayolooo... yang pada nyaleg tiati... kita harus dukung #PPATKdukungPemiluBersih biar pemilu di negara kita ini bisa berjalan jujur dan adil. lanjutkan terus temuan nya pak...,,,
@@@,@@@,2024-01-18T12:53:10.000Z,"semoga setelah penyelidikan oleh ppatk tidak ada lagi transaksi yang mencurigakan dari para caleg ya
#PPATKdukungPemiluBersih",,,
Kenzo,@Kenzo834272422,2024-01-18T11:35:12.000Z,"waduh agak bahaya juga nih, harus segera diselediki si kalo gini #PPATKdukungPemiluBersih",,,
karinanana,@fovlly,2024-01-18T12:52:27.000Z,"aku sih dukung ppatk untuk menuju pemilu 2024 yang bersih tanpa kecurangan
#PPATKdukungPemiluBersih",,,
ch1ll,@upilllucuu,2024-01-18T11:50:55.000Z,semoga pemilu 2024 terlaksana tanpa kecurangan #PPATKdukungPemiluBersih,,,
Lala,@Laladipsii,2024-01-18T11:40:34.000Z,"wah temuan yg sangat mengejutkan, harus ditindaklanjuti supaya pemilu bersih dan damai #PPATKdukungPemiluBersih",,,
Kicku,@Kicku632,2024-01-18T11:32:11.000Z,"Semoga nanti bisa jujur dan adil 
mensukseskan pemilu 2024 
#PPATKdukungPemiluBersih",,,
Fiona Evelyn,@jenoegurlfiertr,2024-01-18T14:35:26.000Z,"wahhh lagi banyaknya ya caleg seperti ini, perlu di tangkap nih supaya kinerja pemerintahan tidak terganggu 
#PPATKdukungPemiluBersih",,,
dija,@taeaimo,2024-01-18T11:39:23.000Z,"diberantas harus semua transaksi mencurigakan supaya pemilu bersih aman dan damai
#PPATKdukungPemiluBersih",,,
dyah,@meowkiyowo,2024-01-18T11:35:55.000Z,salut atas kinerja ppatk sampai bisa menguak kasus transaksi mencurigakan ini. semoga pemilu 2024 tetap bisa berjalan dengan luber jurdil #PPATKdukungPemiluBersih,,,
bebanhidup,@bungsu_beban,2024-01-18T11:35:43.000Z,"keren nih ppatk, terus mengungkap kebenaran ya pak #PPATKdukungPemiluBersih",,,
Mylla ♡ Joki Enstars,@myllacious,2024-01-18T11:36:03.000Z,"baru tau banget nih, semoga pemilu tahun ini bersih dari segala kecurangan #PPATKdukungPemiluBersih",,,
baiqlah,@baiqlah_,2024-01-18T11:41:25.000Z,Semoga dengan adanya PPATK dapat meminimalisir adanya praktek transaksi mencurigakan agar bisa mewujudkan pemilu yang bersih #PPATKdukungPemiluBersih,,,
keii,@miyamureaw,2024-01-18T11:43:17.000Z,semoga pemilu tahun ini dan tahun tahun yang akan datang bisa bersih dari segala kecurangan. #PPATKdukungPemiluBersih,,,
lalafatmala288,@lalafatmala288,2024-01-18T11:33:47.000Z,"semangat terus utk menyukseskan pemilu yg bersih 
#PPATKdukungPemiluBersih",,,
naz,@minedumpies,2024-01-18T11:43:18.000Z,"nah yang kaya gini yang harusnya didukung demi pemilu yang bersih dan jujur, duku terus pokoknyaa semangat ppatk #PPATKDukungPemiluBersih",,,
alfa bann,@BannAlfa,2024-01-18T11:42:51.000Z,"hmm, gak nyangka ada aja caleg yg tega menodai demokrasi Indonesia. semoga pemilu kali ini bener² berjalan secara jujur dan transparan
 #PPATKdukungPemiluBersih",,,
dema,@telyras,2024-01-18T13:55:29.000Z,"transaksi para caleg yang mencurigakan harus diusut tuntas demi pemilu yang bersih 
#PPATKdukungPemiluBersih",,,
naww .𖥔 ݁ ˖,@04kilometros,2024-01-18T11:38:40.000Z,banyak bangettt ternyata hal-hal yang diluar nalar. sampe triliunan gilaaa. harus diusut tuntas nihh!! #PPATdukungPemiluBersih,,,
wulan,@wulants_,2024-01-18T11:48:07.000Z,"duh bisa bisanya masih ada transaksi mencurigakan kayak gini, ayolah kita bikin pemilu yang bersih dan adil kali ini aja
#PPATKdukungPemiluBersih",,,
ino,@lonelynoel_,2024-01-18T11:43:49.000Z,"Semoga saja pemilu 2024 ini terlaksana dengan jujur dan bersih, mantap untuk kepala PPATK #PPATKdukungPemiluBersih",,,
ineedmoney,@milarecently,2024-01-18T11:40:44.000Z,"terimakasih informasinya PPATK, kita jadi tau ternyata banyak caleg yang melakukan kecurangan
#PPATKdukungPemiluBersih",,1.0,
maheng,@mahatmaja1,2024-01-18T13:49:49.000Z,"bener, kita harus curiga terhadap para caleg #PPATKdukungPemiluBersih",,,
ruby rider,@cinnamonrolley,2024-01-18T11:41:27.000Z,"duh ngeri banget yaa, semoga bisa terselesaikan dan berjalan dengan baik #PPATKdukungPemiluBersih",,,1.0
Badai Hujan,@BadaiHujan889,2024-01-18T11:48:42.000Z,"bagus bgttt, semoga pemilu tahun ini bersih dehh #PPATKdukungPemiluBersih",,,
-,@akunuguya_,2024-01-18T11:34:02.000Z,"eh serem amat. ini harus diusut tuntas sih, pemilu harus bersih, jujur dong! #PPATKdukungPemiluBersih",,,
Ekadasa Putra,@ekadasapura,2024-01-18T12:36:35.000Z,"kalau untuk dapat kursi modalnya besar, nanti pas dapat kursi malah mikir balikin modal, jangan sampai deh kayak gitu #PPATKdukungPemiluBersih",,,
runafatia,@runafatia,2024-01-18T11:39:03.000Z,Semoga pemilunya aman dan tidak ada kecurangan #PPATKdukungPemiluBersih,,,
Janinne,@j_jaisanne,2024-01-18T11:39:59.000Z,"bahaya banget harus di usut sampe tuntas deh 
#PPATKdukungPemiluBersih",,,
ꪀׁׅυׁׅꪀׁׅɑׁׅ֮,@hypenunna,2024-01-18T11:34:27.000Z,semangat ppatk untuk mendukung pemilu yang luberjurdil demi indonesia yg lebih baik #PPATKdukungPemiluBersih,,,
ngapain?,@nalatte8,2024-01-18T12:21:35.000Z,Ngeri banget baca beritanya. Duit segitu banyak buat apaan weh. Plis Setelah pemilu ini harus benar benar di usut tuntas. #PPATKdukungPemiluBersih,,,
kjeje,@sqiyx10,2024-01-18T11:40:21.000Z,pemilu tahun 2024 ini harus dilakukan secara libur jurdil sih pokoknya #PPATKdukungPemiluBersih,,,
el,@iamthekid00s,2024-01-18T11:52:45.000Z,semoga pemilu kita bebas dari kecurangan yhh #PPATKdukungPemiluBersih,,,
Spring,@spillorange,2024-01-18T13:26:16.000Z,"Waduh, harus dukung #PPATKdukungPemiluBersih supaya semua sadar sekarang untuk bermain pemilu dengan bersih ya",,,1.0
Sunflowers,@sunflowersssbby,2024-01-18T11:42:10.000Z,bahaya kalau gini bener bener harus diusut #PPATKdukungPemiluBersih,,,
Shei || auto fb,@shei_seylaa,2024-01-18T11:28:11.000Z,"wiii keren, semoga PPATK semakin tanggap #PPATKdukungPemiluBersih",,,
vllyyy,@vysw4l,2024-01-18T11:32:35.000Z,"waaah keren bgt pak,  semoga ppatk ini makin cepet dan bisa mewujudkan dan mensukseskan pemilu 2024 yang bersih #PPATKdukungPemiluBersih",,1.0,
timooty,@timooty2,2024-01-18T11:31:09.000Z,wehhh banyak temuan yang terungkap menjelang pemilu nih #PPATKdukungPemiluBersih,,,
